17:44:17.277112 IP 192.168.100.194.47694 > 192.168.100.130.ftp: Flags [S], seq 953920844, win 14600, options [mss 1460,sackOK,TS val 4436124 ecr 0,nop,wscale 6], length 0
E..<..@.@..V..d...d..N..8..L......9.r..........
.C..........
17:44:17.277354 IP 192.168.100.194.47694 > 192.168.100.130.ftp: Flags [S], seq 953920844, win 14600, options [mss 1460,sackOK,TS val 4436124 ecr 0,nop,wscale 6], length 0
E..<..@.?..V..d...d..N..8..L......9.r..........
.C..........
17:44:17.277476 IP 192.168.100.130.ftp > 192.168.100.194.47694: Flags [S.], seq 2482457856, ack 953920845, win 14480, options [mss 1460,sackOK,TS val 4436082 ecr 4436124,nop,wscale 6], length 0
E..<..@.@..&..d...d....N..M.8..M..8............
.C.r.C......
17:44:17.277628 IP 192.168.100.130.ftp > 192.168.100.194.47694: Flags [S.], seq 2482457856, ack 953920845, win 14480, options [mss 1460,sackOK,TS val 4436082 ecr 4436124,nop,wscale 6], length 0
E..<..@.?..&..d...d....N..M.8..M..8............
.C.r.C......
17:44:17.277644 IP 192.168.100.194.47694 > 192.168.100.130.ftp: Flags [.], ack 1, win 229, options [nop,nop,TS val 4436125 ecr 4436082], length 0
E..4..@.@..]..d...d..N..8..M..M.....H'.....
.C...C.r
17:44:17.277868 IP 192.168.100.194.47694 > 192.168.100.130.ftp: Flags [.], ack 1, win 229, options [nop,nop,TS val 4436125 ecr 4436082], length 0
E..4..@.?..]..d...d..N..8..M..M.....H'.....
.C...C.r
17:44:17.279273 IP 192.168.100.130.ftp > 192.168.100.194.47694: Flags [P.], seq 1:21, ack 1, win 227, options [nop,nop,TS val 4436082 ecr 4436125], length 20
E..H.s@.@.....d...d....N..M.8..M...........
.C.r.C..220 (vsFTPd 2.2.2)

17:44:17.279276 IP 192.168.100.130.ftp > 192.168.100.194.47694: Flags [P.], seq 1:21, ack 1, win 227, options [nop,nop,TS val 4436082 ecr 4436125], length 20
E..H.s@.?.....d...d....N..M.8..M...........
.C.r.C..220 (vsFTPd 2.2.2)

17:44:17.279374 IP 192.168.100.194.47694 > 192.168.100.130.ftp: Flags [.], ack 21, win 229, options [nop,nop,TS val 4436127 ecr 4436082], length 0
E..4..@.@..L..d...d..N..8..M..M.....H......
.C...C.r
17:44:17.279495 IP 192.168.100.194.47694 > 192.168.100.130.ftp: Flags [P.], seq 1:14, ack 21, win 229, options [nop,nop,TS val 4436127 ecr 4436082], length 13
E..A..@.@..>..d...d..N..8..M..M.....J......
.C...C.rAUTH GSSAPI

17:44:17.279566 IP 192.168.100.194.47694 > 192.168.100.130.ftp: Flags [.], ack 21, win 229, options [nop,nop,TS val 4436127 ecr 4436082], length 0
E..4..@.?..L..d...d..N..8..M..M.....H......
.C...C.r
17:44:17.279694 IP 192.168.100.194.47694 > 192.168.100.130.ftp: Flags [P.], seq 1:14, ack 21, win 229, options [nop,nop,TS val 4436127 ecr 4436082], length 13
E..A..@.?..>..d...d..N..8..M..M......f.....
.C...C.rAUTH GSSAPI

17:44:17.279795 IP 192.168.100.130.ftp > 192.168.100.194.47694: Flags [.], ack 14, win 227, options [nop,nop,TS val 4436084 ecr 4436127], length 0
E..4.t@.@.....d...d....N..M.8..Z....H......
.C.t.C..
17:44:17.279952 IP 192.168.100.130.ftp > 192.168.100.194.47694: Flags [P.], seq 21:59, ack 14, win 227, options [nop,nop,TS val 4436084 ecr 4436127], length 38
E..Z.u@.@.....d...d....N..M.8..Z...........
.C.t.C..530 Please login with USER and PASS.

17:44:17.279955 IP 192.168.100.130.ftp > 192.168.100.194.47694: Flags [.], ack 14, win 227, options [nop,nop,TS val 4436084 ecr 4436127], length 0
E..4.t@.?.....d...d....N..M.8..Z....H......
.C.t.C..
17:44:17.279958 IP 192.168.100.130.ftp > 192.168.100.194.47694: Flags [P.], seq 21:59, ack 14, win 227, options [nop,nop,TS val 4436084 ecr 4436127], length 38
E..Z.u@.?.....d...d....N..M.8..Z...........
.C.t.C..530 Please login with USER and PASS.

17:44:17.320385 IP 192.168.100.194.47694 > 192.168.100.130.ftp: Flags [.], ack 59, win 229, options [nop,nop,TS val 4436168 ecr 4436084], length 0
E..4..@.@..J..d...d..N..8..Z..M;....G......
.C...C.t
17:44:17.320676 IP 192.168.100.194.47694 > 192.168.100.130.ftp: Flags [.], ack 59, win 229, options [nop,nop,TS val 4436168 ecr 4436084], length 0
E..4..@.?..J..d...d..N..8..Z..M;....G......
.C...C.t
17:44:20.645852 IP 192.168.100.194.47694 > 192.168.100.130.ftp: Flags [P.], seq 14:28, ack 59, win 229, options [nop,nop,TS val 4439493 ecr 4436084], length 14
E..B..@.@..;..d...d..N..8..Z..M;....J......
.C...C.tUSER Clinton

17:44:20.646163 IP 192.168.100.194.47694 > 192.168.100.130.ftp: Flags [P.], seq 14:28, ack 59, win 229, options [nop,nop,TS val 4439493 ecr 4436084], length 14
E..B..@.?..;..d...d..N..8..Z..M;....(a.....
.C...C.tUSER Clinton

17:44:20.646370 IP 192.168.100.130.ftp > 192.168.100.194.47694: Flags [P.], seq 59:93, ack 28, win 227, options [nop,nop,TS val 4439451 ecr 4439493], length 34
E..V.v@.@.....d...d....N..M;8..h.....7.....
.C...C..331 Please specify the password.

17:44:20.646470 IP 192.168.100.130.ftp > 192.168.100.194.47694: Flags [P.], seq 59:93, ack 28, win 227, options [nop,nop,TS val 4439451 ecr 4439493], length 34
E..V.v@.?.....d...d....N..M;8..h.....7.....
.C...C..331 Please specify the password.

17:44:20.646512 IP 192.168.100.194.47694 > 192.168.100.130.ftp: Flags [.], ack 93, win 229, options [nop,nop,TS val 4439494 ecr 4439451], length 0
E..4..@.@..H..d...d..N..8..h..M]....-^.....
.C...C..
17:44:20.646702 IP 192.168.100.194.47694 > 192.168.100.130.ftp: Flags [.], ack 93, win 229, options [nop,nop,TS val 4439494 ecr 4439451], length 0
E..4..@.?..H..d...d..N..8..h..M]....-^.....
.C...C..
17:44:25.781389 IP 192.168.100.194.47694 > 192.168.100.130.ftp: Flags [P.], seq 28:49, ack 93, win 229, options [nop,nop,TS val 4444629 ecr 4439451], length 21
E..I..@.@..2..d...d..N..8..h..M]....J......
.C...C..PASS Obama$$barrack

17:44:25.781646 IP 192.168.100.194.47694 > 192.168.100.130.ftp: Flags [P.], seq 28:49, ack 93, win 229, options [nop,nop,TS val 4444629 ecr 4439451], length 21
E..I..@.?..2..d...d..N..8..h..M].....".....
.C...C..PASS Obama$$barrack

17:44:25.802551 IP 192.168.100.130.ftp > 192.168.100.194.47694: Flags [P.], seq 93:116, ack 49, win 227, options [nop,nop,TS val 4444606 ecr 4444629], length 23
E..K.w@.@.....d...d....N..M]8..}....#......
.C...C..230 Login successful.

17:44:25.802668 IP 192.168.100.130.ftp > 192.168.100.194.47694: Flags [P.], seq 93:116, ack 49, win 227, options [nop,nop,TS val 4444606 ecr 4444629], length 23
E..K.w@.?.....d...d....N..M]8..}....#......
.C...C..230 Login successful.

17:44:25.802715 IP 192.168.100.194.47694 > 192.168.100.130.ftp: Flags [.], ack 116, win 229, options [nop,nop,TS val 4444650 ecr 4444606], length 0
E..4..@.@..F..d...d..N..8..}..Mt...........
.C...C..
17:44:25.802809 IP 192.168.100.194.47694 > 192.168.100.130.ftp: Flags [P.], seq 49:55, ack 116, win 229, options [nop,nop,TS val 4444650 ecr 4444606], length 6
E..:..@.@..?..d...d..N..8..}..Mt....J......
.C...C..SYST

17:44:25.802868 IP 192.168.100.194.47694 > 192.168.100.130.ftp: Flags [.], ack 116, win 229, options [nop,nop,TS val 4444650 ecr 4444606], length 0
E..4..@.?..F..d...d..N..8..}..Mt...........
.C...C..
17:44:25.802929 IP 192.168.100.194.47694 > 192.168.100.130.ftp: Flags [P.], seq 49:55, ack 116, win 229, options [nop,nop,TS val 4444650 ecr 4444606], length 6
E..:..@.?..?..d...d..N..8..}..Mt....Q%.....
.C...C..SYST

17:44:25.803123 IP 192.168.100.130.ftp > 192.168.100.194.47694: Flags [P.], seq 116:135, ack 55, win 227, options [nop,nop,TS val 4444607 ecr 4444650], length 19
E..G.x@.@.....d...d....N..Mt8........z.....
.C...C..215 UNIX Type: L8

17:44:25.803125 IP 192.168.100.130.ftp > 192.168.100.194.47694: Flags [P.], seq 116:135, ack 55, win 227, options [nop,nop,TS val 4444607 ecr 4444650], length 19
E..G.x@.?.....d...d....N..Mt8........z.....
.C...C..215 UNIX Type: L8

17:44:25.843868 IP 192.168.100.194.47694 > 192.168.100.130.ftp: Flags [.], ack 135, win 229, options [nop,nop,TS val 4444691 ecr 4444607], length 0
E..4..@.@..D..d...d..N..8.....M............
.C...C..
17:44:25.844162 IP 192.168.100.194.47694 > 192.168.100.130.ftp: Flags [.], ack 135, win 229, options [nop,nop,TS val 4444691 ecr 4444607], length 0
E..4..@.?..D..d...d..N..8.....M............
.C...C..
17:44:27.910084 IP 192.168.100.194.47694 > 192.168.100.130.ftp: Flags [P.], seq 55:61, ack 135, win 229, options [nop,nop,TS val 4446757 ecr 4444607], length 6
E..:..@.@..=..d...d..N..8.....M.....J......
.C.%.C..QUIT

17:44:27.910434 IP 192.168.100.194.47694 > 192.168.100.130.ftp: Flags [P.], seq 55:61, ack 135, win 229, options [nop,nop,TS val 4446757 ecr 4444607], length 6
E..:..@.?..=..d...d..N..8.....M.....T......
.C.%.C..QUIT

17:44:27.910528 IP 192.168.100.130.ftp > 192.168.100.194.47694: Flags [P.], seq 135:149, ack 61, win 227, options [nop,nop,TS val 4446715 ecr 4446757], length 14
E..B.y@.@.....d...d....N..M.8........h.....
.C...C.%221 Goodbye.

17:44:27.910594 IP 192.168.100.130.ftp > 192.168.100.194.47694: Flags [F.], seq 149, ack 61, win 227, options [nop,nop,TS val 4446715 ecr 4446757], length 0
E..4.z@.@.....d...d....N..M.8........F.....
.C...C.%
17:44:27.910653 IP 192.168.100.130.ftp > 192.168.100.194.47694: Flags [P.], seq 135:149, ack 61, win 227, options [nop,nop,TS val 4446715 ecr 4446757], length 14
E..B.y@.?.....d...d....N..M.8........h.....
.C...C.%221 Goodbye.

17:44:27.910717 IP 192.168.100.130.ftp > 192.168.100.194.47694: Flags [F.], seq 149, ack 61, win 227, options [nop,nop,TS val 4446715 ecr 4446757], length 0
E..4.z@.?.....d...d....N..M.8........F.....
.C...C.%
17:44:27.910791 IP 192.168.100.194.47694 > 192.168.100.130.ftp: Flags [.], ack 149, win 229, options [nop,nop,TS val 4446758 ecr 4446715], length 0
E..4..@.@..B..d...d..N..8.....M......D.....
.C.&.C..
17:44:27.910971 IP 192.168.100.194.47694 > 192.168.100.130.ftp: Flags [.], ack 149, win 229, options [nop,nop,TS val 4446758 ecr 4446715], length 0
E..4..@.?..B..d...d..N..8.....M......D.....
.C.&.C..
17:44:27.911137 IP 192.168.100.194.47694 > 192.168.100.130.ftp: Flags [F.], seq 61, ack 150, win 229, options [nop,nop,TS val 4446758 ecr 4446715], length 0
E..4..@.@..A..d...d..N..8.....M......B.....
.C.&.C..
17:44:27.911538 IP 192.168.100.194.47694 > 192.168.100.130.ftp: Flags [F.], seq 61, ack 150, win 229, options [nop,nop,TS val 4446758 ecr 4446715], length 0
E..4..@.?..A..d...d..N..8.....M......B.....
.C.&.C..
17:44:27.911540 IP 192.168.100.130.ftp > 192.168.100.194.47694: Flags [.], ack 62, win 227, options [nop,nop,TS val 4446716 ecr 4446758], length 0
E..4.{@.@.....d...d....N..M.8........C.....
.C...C.&
17:44:27.911541 IP 192.168.100.130.ftp > 192.168.100.194.47694: Flags [.], ack 62, win 227, options [nop,nop,TS val 4446716 ecr 4446758], length 0
E..4.{@.?.....d...d....N..M.8........C.....
.C...C.&

