15:38:22.108301 IP 192.168.100.194 > 192.168.100.130: ESP(spi=0xfa94623c,seq=0x125), length 100
15:38:22.110278 IP 192.168.100.194 > 192.168.100.130: ESP(spi=0xfa94623c,seq=0x125), length 100
15:38:22.110515 IP 192.168.100.130 > 192.168.100.194: ESP(spi=0x7a765556,seq=0xfa), length 100
15:38:22.113959 ARP, Request who-has 192.168.100.194 tell 192.168.100.193, length 46
15:38:22.113999 ARP, Reply 192.168.100.194 is-at 00:50:56:21:23:4b (oui Unknown), length 28
15:38:22.114256 IP 192.168.100.130 > 192.168.100.194: ESP(spi=0x7a765556,seq=0xfa), length 100
