15:28:13.936822 IP 192.168.100.194 > 192.168.100.130: ESP(spi=0xfa94623c,seq=0xc3), length 100
15:28:13.937247 IP 192.168.100.194 > 192.168.100.130: ESP(spi=0xfa94623c,seq=0xc3), length 100
15:28:13.937468 IP 192.168.100.130 > 192.168.100.194: ESP(spi=0x7a765556,seq=0xad), length 100
15:28:13.937628 IP 192.168.100.130 > 192.168.100.194: ESP(spi=0x7a765556,seq=0xad), length 100
15:28:13.937760 IP 192.168.100.194 > 192.168.100.130: ESP(spi=0xfa94623c,seq=0xc4), length 100
15:28:13.938025 IP 192.168.100.194 > 192.168.100.130: ESP(spi=0xfa94623c,seq=0xc4), length 100
