15:22:43.630852 IP 192.168.100.194 > 192.168.100.130: ESP(spi=0xfa94623c,seq=0x25), length 132
15:22:43.631434 IP 192.168.100.194 > 192.168.100.130: ESP(spi=0xfa94623c,seq=0x25), length 132
15:22:43.631717 IP 192.168.100.130 > 192.168.100.194: ESP(spi=0x7a765556,seq=0x25), length 132
15:22:43.631982 IP 192.168.100.130 > 192.168.100.194: ESP(spi=0x7a765556,seq=0x25), length 132
15:22:44.632006 IP 192.168.100.194 > 192.168.100.130: ESP(spi=0xfa94623c,seq=0x26), length 132
15:22:44.632221 IP 192.168.100.194 > 192.168.100.130: ESP(spi=0xfa94623c,seq=0x26), length 132
