17:38:55.168849 IP 192.168.100.194.53163 > 192.168.100.130.telnet: Flags [S], seq 3898973823, win 14600, options [mss 1460,sackOK,TS val 4114016 ecr 0,nop,wscale 6], length 0
E..<X.@.@.....d...d......e........9............
.>.`........
17:38:55.169252 IP 192.168.100.194.53163 > 192.168.100.130.telnet: Flags [S], seq 3898973823, win 14600, options [mss 1460,sackOK,TS val 4114016 ecr 0,nop,wscale 6], length 0
E..<X.@.?.....d...d......e........9............
.>.`........
17:38:55.169254 IP 192.168.100.130.telnet > 192.168.100.194.53163: Flags [S.], seq 1094041617, ack 3898973824, win 14480, options [mss 1460,sackOK,TS val 4113974 ecr 4114016,nop,wscale 6], length 0
E..<..@.@..&..d...d.....A5...e....8............
.>.6.>.`....
17:38:55.169398 IP 192.168.100.130.telnet > 192.168.100.194.53163: Flags [S.], seq 1094041617, ack 3898973824, win 14480, options [mss 1460,sackOK,TS val 4113974 ecr 4114016,nop,wscale 6], length 0
E..<..@.?..&..d...d.....A5...e....8............
.>.6.>.`....
17:38:55.169415 IP 192.168.100.194.53163 > 192.168.100.130.telnet: Flags [.], ack 1, win 229, options [nop,nop,TS val 4114017 ecr 4113974], length 0
E..4X @.@.....d...d......e..A5......F=.....
.>.a.>.6
17:38:55.169684 IP 192.168.100.194.53163 > 192.168.100.130.telnet: Flags [.], ack 1, win 229, options [nop,nop,TS val 4114017 ecr 4113974], length 0
E..4X @.?.....d...d......e..A5......F=.....
.>.a.>.6
17:38:55.169921 IP 192.168.100.194.53163 > 192.168.100.130.telnet: Flags [P.], seq 1:34, ack 1, win 229, options [nop,nop,TS val 4114017 ecr 4113974], length 33
E..UX!@.@.....d...d......e..A5......J......
.>.a.>.6..&..&........... ..!.."..'.....#
17:38:55.170169 IP 192.168.100.194.53163 > 192.168.100.130.telnet: Flags [P.], seq 1:34, ack 1, win 229, options [nop,nop,TS val 4114017 ecr 4113974], length 33
E..UX!@.?.....d...d......e..A5.............
.>.a.>.6..&..&........... ..!.."..'.....#
17:38:55.170171 IP 192.168.100.130.telnet > 192.168.100.194.53163: Flags [.], ack 34, win 227, options [nop,nop,TS val 4113975 ecr 4114017], length 0
E..4.$@.@..
..d...d.....A5...e......F......
.>.7.>.a
17:38:55.170232 IP 192.168.100.130.telnet > 192.168.100.194.53163: Flags [.], ack 34, win 227, options [nop,nop,TS val 4113975 ecr 4114017], length 0
E..4.$@.?..
..d...d.....A5...e......F......
.>.7.>.a
17:38:55.181945 IP 192.168.100.130.telnet > 192.168.100.194.53163: Flags [P.], seq 1:13, ack 34, win 227, options [nop,nop,TS val 4113985 ecr 4114017], length 12
E..@.%@.@.....d...d.....A5...e.............
.>.A.>.a..... ..#..'
17:38:55.181953 IP 192.168.100.130.telnet > 192.168.100.194.53163: Flags [P.], seq 1:13, ack 34, win 227, options [nop,nop,TS val 4113985 ecr 4114017], length 12
E..@.%@.?.....d...d.....A5...e.............
.>.A.>.a..... ..#..'
17:38:55.181967 IP 192.168.100.194.53163 > 192.168.100.130.telnet: Flags [.], ack 13, win 229, options [nop,nop,TS val 4114029 ecr 4113985], length 0
E..4X"@.@.....d...d......e..A5......E......
.>.m.>.A
17:38:55.182225 IP 192.168.100.194.53163 > 192.168.100.130.telnet: Flags [.], ack 13, win 229, options [nop,nop,TS val 4114029 ecr 4113985], length 0
E..4X"@.?.....d...d......e..A5......E......
.>.m.>.A
17:38:55.182318 IP 192.168.100.130.telnet > 192.168.100.194.53163: Flags [P.], seq 13:58, ack 34, win 227, options [nop,nop,TS val 4113987 ecr 4114029], length 45
E..a.&@.@.....d...d.....A5...e......E......
.>.C.>.m..&..&........!.."..... .....#.....'.........
17:38:55.182411 IP 192.168.100.130.telnet > 192.168.100.194.53163: Flags [P.], seq 13:58, ack 34, win 227, options [nop,nop,TS val 4113987 ecr 4114029], length 45
E..a.&@.?.....d...d.....A5...e......E......
.>.C.>.m..&..&........!.."..... .....#.....'.........
17:38:55.182418 IP 192.168.100.194.53163 > 192.168.100.130.telnet: Flags [.], ack 58, win 229, options [nop,nop,TS val 4114030 ecr 4113987], length 0
E..4X#@.@.....d...d......e..A5.K....E......
.>.n.>.C
17:38:55.182548 IP 192.168.100.194.53163 > 192.168.100.130.telnet: Flags [.], ack 58, win 229, options [nop,nop,TS val 4114030 ecr 4113987], length 0
E..4X#@.?.....d...d......e..A5.K....E......
.>.n.>.C
17:38:55.182744 IP 192.168.100.194.53163 > 192.168.100.130.telnet: Flags [P.], seq 34:148, ack 58, win 229, options [nop,nop,TS val 4114030 ecr 4113987], length 114
E...X$@.@.....d...d......e..A5.K....K......
.>.n.>.C....P...... .38400,38400....#.pvssvr10-bln.localdomain:0.0....'..DISPLAY.pvssvr10-bln.localdomain:0.0......XTERM..
17:38:55.182988 IP 192.168.100.194.53163 > 192.168.100.130.telnet: Flags [P.], seq 34:148, ack 58, win 229, options [nop,nop,TS val 4114030 ecr 4113987], length 114
E...X$@.?.....d...d......e..A5.K...........
.>.n.>.C....P...... .38400,38400....#.pvssvr10-bln.localdomain:0.0....'..DISPLAY.pvssvr10-bln.localdomain:0.0......XTERM..
17:38:55.183284 IP 192.168.100.130.telnet > 192.168.100.194.53163: Flags [P.], seq 58:61, ack 148, win 227, options [nop,nop,TS val 4113987 ecr 4114030], length 3
E..7.'@.@.....d...d.....A5.K.e......DP.....
.>.C.>.n...
17:38:55.183350 IP 192.168.100.130.telnet > 192.168.100.194.53163: Flags [P.], seq 58:61, ack 148, win 227, options [nop,nop,TS val 4113987 ecr 4114030], length 3
E..7.'@.?.....d...d.....A5.K.e......DP.....
.>.C.>.n...
17:38:55.183407 IP 192.168.100.194.53163 > 192.168.100.130.telnet: Flags [P.], seq 148:151, ack 61, win 229, options [nop,nop,TS val 4114031 ecr 4113987], length 3
E..7X%@.@.....d...d......e..A5.N....J......
.>.o.>.C...
17:38:55.183616 IP 192.168.100.194.53163 > 192.168.100.130.telnet: Flags [P.], seq 148:151, ack 61, win 229, options [nop,nop,TS val 4114031 ecr 4113987], length 3
E..7X%@.?.....d...d......e..A5.N....DK.....
.>.o.>.C...
17:38:55.185000 IP 192.168.100.130.telnet > 192.168.100.194.53163: Flags [P.], seq 61:135, ack 151, win 227, options [nop,nop,TS val 4113989 ecr 4114031], length 74
E..~.(@.@.....d...d.....A5.N.e.......b.....
.>.E.>.o...CentOS release 6.4 (Final)
Kernel 2.6.32-358.el6.x86_64 on an x86_64

17:38:55.185101 IP 192.168.100.130.telnet > 192.168.100.194.53163: Flags [P.], seq 61:135, ack 151, win 227, options [nop,nop,TS val 4113989 ecr 4114031], length 74
E..~.(@.?.....d...d.....A5.N.e.......b.....
.>.E.>.o...CentOS release 6.4 (Final)
Kernel 2.6.32-358.el6.x86_64 on an x86_64

17:38:55.185162 IP 192.168.100.194.53163 > 192.168.100.130.telnet: Flags [P.], seq 151:154, ack 135, win 229, options [nop,nop,TS val 4114033 ecr 4113989], length 3
E..7X&@.@.....d...d......e..A5......J......
.>.q.>.E...
17:38:55.185368 IP 192.168.100.194.53163 > 192.168.100.130.telnet: Flags [P.], seq 151:154, ack 135, win 229, options [nop,nop,TS val 4114033 ecr 4113989], length 3
E..7X&@.?.....d...d......e..A5......C......
.>.q.>.E...
17:38:55.188248 IP 192.168.100.130.telnet > 192.168.100.194.53163: Flags [P.U], seq 135:136, ack 154, win 227, urg 1, options [nop,nop,TS val 4113990 ecr 4114033], length 1
E..5.)@.@.....d...d.....A5...e...8..E......
.>.F.>.q.
17:38:55.188250 IP 192.168.100.130.telnet > 192.168.100.194.53163: Flags [P.], seq 136:137, ack 154, win 227, options [nop,nop,TS val 4113993 ecr 4114033], length 1
E..5.*@.@.....d...d.....A5...e......R......
.>.I.>.q.
17:38:55.188310 IP 192.168.100.130.telnet > 192.168.100.194.53163: Flags [P.U], seq 135:136, ack 154, win 227, urg 1, options [nop,nop,TS val 4113990 ecr 4114033], length 1
E..5.)@.?.....d...d.....A5...e...8..E......
.>.F.>.q.
17:38:55.188377 IP 192.168.100.130.telnet > 192.168.100.194.53163: Flags [P.], seq 136:137, ack 154, win 227, options [nop,nop,TS val 4113993 ecr 4114033], length 1
E..5.*@.?.....d...d.....A5...e......R......
.>.I.>.q.
17:38:55.188484 IP 192.168.100.194.53163 > 192.168.100.130.telnet: Flags [.], ack 137, win 229, options [nop,nop,TS val 4114036 ecr 4113990], length 0
E..4X'@.@.....d...d......e..A5......D......
.>.t.>.F
17:38:55.188667 IP 192.168.100.194.53163 > 192.168.100.130.telnet: Flags [.], ack 137, win 229, options [nop,nop,TS val 4114036 ecr 4113990], length 0
E..4X'@.?.....d...d......e..A5......D......
.>.t.>.F
17:38:55.190346 IP 192.168.100.130.telnet > 192.168.100.194.53163: Flags [P.], seq 137:144, ack 154, win 227, options [nop,nop,TS val 4113995 ecr 4114036], length 7
E..;.+@.@.....d...d.....A5...e.............
.>.K.>.tlogin: 
17:38:55.190445 IP 192.168.100.130.telnet > 192.168.100.194.53163: Flags [P.], seq 137:144, ack 154, win 227, options [nop,nop,TS val 4113995 ecr 4114036], length 7
E..;.+@.?.....d...d.....A5...e.............
.>.K.>.tlogin: 
17:38:55.231589 IP 192.168.100.194.53163 > 192.168.100.130.telnet: Flags [.], ack 144, win 229, options [nop,nop,TS val 4114079 ecr 4113995], length 0
E..4X(@.@.....d...d......e..A5......D......
.>...>.K
17:38:55.231849 IP 192.168.100.194.53163 > 192.168.100.130.telnet: Flags [.], ack 144, win 229, options [nop,nop,TS val 4114079 ecr 4113995], length 0
E..4X(@.?.....d...d......e..A5......D......
.>...>.K
17:38:57.902616 IP 192.168.100.194.53163 > 192.168.100.130.telnet: Flags [P.], seq 154:155, ack 144, win 229, options [nop,nop,TS val 4116750 ecr 4113995], length 1
E..5X)@.@.....d...d......e..A5......J......
.>...>.KC
17:38:57.903003 IP 192.168.100.194.53163 > 192.168.100.130.telnet: Flags [P.], seq 154:155, ack 144, win 229, options [nop,nop,TS val 4116750 ecr 4113995], length 1
E..5X)@.?.....d...d......e..A5.......I.....
.>...>.KC
17:38:57.910056 IP 192.168.100.130.telnet > 192.168.100.194.53163: Flags [P.], seq 144:145, ack 155, win 227, options [nop,nop,TS val 4116714 ecr 4116750], length 1
E..5.,@.@.....d...d.....A5...e.............
.>...>..C
17:38:57.910196 IP 192.168.100.130.telnet > 192.168.100.194.53163: Flags [P.], seq 144:145, ack 155, win 227, options [nop,nop,TS val 4116714 ecr 4116750], length 1
E..5.,@.?.....d...d.....A5...e.............
.>...>..C
17:38:57.910217 IP 192.168.100.194.53163 > 192.168.100.130.telnet: Flags [.], ack 145, win 229, options [nop,nop,TS val 4116757 ecr 4116714], length 0
E..4X*@.@.....d...d......e..A5....../......
.>...>..
17:38:57.910570 IP 192.168.100.194.53163 > 192.168.100.130.telnet: Flags [.], ack 145, win 229, options [nop,nop,TS val 4116757 ecr 4116714], length 0
E..4X*@.?.....d...d......e..A5....../......
.>...>..
17:38:58.102701 IP 192.168.100.194.53163 > 192.168.100.130.telnet: Flags [P.], seq 155:156, ack 145, win 229, options [nop,nop,TS val 4116950 ecr 4116714], length 1
E..5X+@.@.....d...d......e..A5......J......
.>...>..l
17:38:58.103132 IP 192.168.100.194.53163 > 192.168.100.130.telnet: Flags [P.], seq 155:156, ack 145, win 229, options [nop,nop,TS val 4116950 ecr 4116714], length 1
E..5X+@.?.....d...d......e..A5.............
.>...>..l
17:38:58.109308 IP 192.168.100.130.telnet > 192.168.100.194.53163: Flags [P.], seq 145:146, ack 156, win 227, options [nop,nop,TS val 4116913 ecr 4116950], length 1
E..5.-@.@.....d...d.....A5...e.............
.>...>..l
17:38:58.109435 IP 192.168.100.130.telnet > 192.168.100.194.53163: Flags [P.], seq 145:146, ack 156, win 227, options [nop,nop,TS val 4116913 ecr 4116950], length 1
E..5.-@.?.....d...d.....A5...e.............
.>...>..l
17:38:58.109454 IP 192.168.100.194.53163 > 192.168.100.130.telnet: Flags [.], ack 146, win 229, options [nop,nop,TS val 4116957 ecr 4116913], length 0
E..4X,@.@.....d...d......e..A5.............
.>...>..
17:38:58.109687 IP 192.168.100.194.53163 > 192.168.100.130.telnet: Flags [.], ack 146, win 229, options [nop,nop,TS val 4116957 ecr 4116913], length 0
E..4X,@.?.....d...d......e..A5.............
.>...>..
17:38:58.262651 IP 192.168.100.194.53163 > 192.168.100.130.telnet: Flags [P.], seq 156:157, ack 146, win 229, options [nop,nop,TS val 4117110 ecr 4116913], length 1
E..5X-@.@.....d...d......e..A5......J......
.>.v.>..i
17:38:58.263073 IP 192.168.100.194.53163 > 192.168.100.130.telnet: Flags [P.], seq 156:157, ack 146, win 229, options [nop,nop,TS val 4117110 ecr 4116913], length 1
E..5X-@.?.....d...d......e..A5.......w.....
.>.v.>..i
17:38:58.269447 IP 192.168.100.130.telnet > 192.168.100.194.53163: Flags [P.], seq 146:147, ack 157, win 227, options [nop,nop,TS val 4117074 ecr 4117110], length 1
E..5..@.@.....d...d.....A5...e.............
.>.R.>.vi
17:38:58.269640 IP 192.168.100.130.telnet > 192.168.100.194.53163: Flags [P.], seq 146:147, ack 157, win 227, options [nop,nop,TS val 4117074 ecr 4117110], length 1
E..5..@.?.....d...d.....A5...e.............
.>.R.>.vi
17:38:58.269662 IP 192.168.100.194.53163 > 192.168.100.130.telnet: Flags [.], ack 147, win 229, options [nop,nop,TS val 4117117 ecr 4117074], length 0
E..4X.@.@.....d...d......e..A5......,......
.>.}.>.R
17:38:58.269921 IP 192.168.100.194.53163 > 192.168.100.130.telnet: Flags [.], ack 147, win 229, options [nop,nop,TS val 4117117 ecr 4117074], length 0
E..4X.@.?.....d...d......e..A5......,......
.>.}.>.R
17:38:58.414635 IP 192.168.100.194.53163 > 192.168.100.130.telnet: Flags [P.], seq 157:158, ack 147, win 229, options [nop,nop,TS val 4117262 ecr 4117074], length 1
E..5X/@.@.....d...d......e..A5......J......
.>...>.Rn
17:38:58.415092 IP 192.168.100.194.53163 > 192.168.100.130.telnet: Flags [P.], seq 157:158, ack 147, win 229, options [nop,nop,TS val 4117262 ecr 4117074], length 1
E..5X/@.?.....d...d......e..A5.......<.....
.>...>.Rn
17:38:58.421917 IP 192.168.100.130.telnet > 192.168.100.194.53163: Flags [P.], seq 147:148, ack 158, win 227, options [nop,nop,TS val 4117226 ecr 4117262], length 1
E..5./@.@.....d...d.....A5...e.............
.>...>..n
17:38:58.422111 IP 192.168.100.130.telnet > 192.168.100.194.53163: Flags [P.], seq 147:148, ack 158, win 227, options [nop,nop,TS val 4117226 ecr 4117262], length 1
E..5./@.?.....d...d.....A5...e.............
.>...>..n
17:38:58.422134 IP 192.168.100.194.53163 > 192.168.100.130.telnet: Flags [.], ack 148, win 229, options [nop,nop,TS val 4117270 ecr 4117226], length 0
E..4X0@.@.....d...d......e..A5......+......
.>...>..
17:38:58.422460 IP 192.168.100.194.53163 > 192.168.100.130.telnet: Flags [.], ack 148, win 229, options [nop,nop,TS val 4117270 ecr 4117226], length 0
E..4X0@.?.....d...d......e..A5......+......
.>...>..
17:38:58.542525 IP 192.168.100.194.53163 > 192.168.100.130.telnet: Flags [P.], seq 158:159, ack 148, win 229, options [nop,nop,TS val 4117390 ecr 4117226], length 1
E..5X1@.@.....d...d......e..A5......J......
.>...>..t
17:38:58.542866 IP 192.168.100.194.53163 > 192.168.100.130.telnet: Flags [P.], seq 158:159, ack 148, win 229, options [nop,nop,TS val 4117390 ecr 4117226], length 1
E..5X1@.?.....d...d......e..A5.......".....
.>...>..t
17:38:58.550728 IP 192.168.100.130.telnet > 192.168.100.194.53163: Flags [P.], seq 148:149, ack 159, win 227, options [nop,nop,TS val 4117355 ecr 4117390], length 1
E..5.0@.@.....d...d.....A5...e.............
.>.k.>..t
17:38:58.550923 IP 192.168.100.130.telnet > 192.168.100.194.53163: Flags [P.], seq 148:149, ack 159, win 227, options [nop,nop,TS val 4117355 ecr 4117390], length 1
E..5.0@.?.....d...d.....A5...e.............
.>.k.>..t
17:38:58.550941 IP 192.168.100.194.53163 > 192.168.100.130.telnet: Flags [.], ack 149, win 229, options [nop,nop,TS val 4117398 ecr 4117355], length 0
E..4X2@.@.....d...d......e..A5......*......
.>...>.k
17:38:58.551200 IP 192.168.100.194.53163 > 192.168.100.130.telnet: Flags [.], ack 149, win 229, options [nop,nop,TS val 4117398 ecr 4117355], length 0
E..4X2@.?.....d...d......e..A5......*......
.>...>.k
17:38:58.654700 IP 192.168.100.194.53163 > 192.168.100.130.telnet: Flags [P.], seq 159:160, ack 149, win 229, options [nop,nop,TS val 4117502 ecr 4117355], length 1
E..5X3@.@.....d...d......e..A5......J......
.>...>.ko
17:38:58.655059 IP 192.168.100.194.53163 > 192.168.100.130.telnet: Flags [P.], seq 159:160, ack 149, win 229, options [nop,nop,TS val 4117502 ecr 4117355], length 1
E..5X3@.?.....d...d......e..A5......./.....
.>...>.ko
17:38:58.664054 IP 192.168.100.130.telnet > 192.168.100.194.53163: Flags [P.], seq 149:150, ack 160, win 227, options [nop,nop,TS val 4117468 ecr 4117502], length 1
E..5.1@.@.....d...d.....A5...e.............
.>...>..o
17:38:58.664250 IP 192.168.100.130.telnet > 192.168.100.194.53163: Flags [P.], seq 149:150, ack 160, win 227, options [nop,nop,TS val 4117468 ecr 4117502], length 1
E..5.1@.?.....d...d.....A5...e.............
.>...>..o
17:38:58.664270 IP 192.168.100.194.53163 > 192.168.100.130.telnet: Flags [.], ack 150, win 229, options [nop,nop,TS val 4117512 ecr 4117468], length 0
E..4X4@.@.....d...d......e..A5......)......
.>...>..
17:38:58.664597 IP 192.168.100.194.53163 > 192.168.100.130.telnet: Flags [.], ack 150, win 229, options [nop,nop,TS val 4117512 ecr 4117468], length 0
E..4X4@.?.....d...d......e..A5......)......
.>...>..
17:38:58.826213 IP 192.168.100.194.53163 > 192.168.100.130.telnet: Flags [P.], seq 160:161, ack 150, win 229, options [nop,nop,TS val 4117674 ecr 4117468], length 1
E..5X5@.@.....d...d......e..A5......J......
.>...>..n
17:38:58.826570 IP 192.168.100.194.53163 > 192.168.100.130.telnet: Flags [P.], seq 160:161, ack 150, win 229, options [nop,nop,TS val 4117674 ecr 4117468], length 1
E..5X5@.?.....d...d......e..A5.............
.>...>..n
17:38:58.834241 IP 192.168.100.130.telnet > 192.168.100.194.53163: Flags [P.], seq 150:151, ack 161, win 227, options [nop,nop,TS val 4117638 ecr 4117674], length 1
E..5.2@.@.....d...d.....A5...e. .....g.....
.>...>..n
17:38:58.834436 IP 192.168.100.130.telnet > 192.168.100.194.53163: Flags [P.], seq 150:151, ack 161, win 227, options [nop,nop,TS val 4117638 ecr 4117674], length 1
E..5.2@.?.....d...d.....A5...e. .....g.....
.>...>..n
17:38:58.834456 IP 192.168.100.194.53163 > 192.168.100.130.telnet: Flags [.], ack 151, win 229, options [nop,nop,TS val 4117682 ecr 4117638], length 0
E..4X6@.@.....d...d......e. A5......(f.....
.>...>..
17:38:58.834783 IP 192.168.100.194.53163 > 192.168.100.130.telnet: Flags [.], ack 151, win 229, options [nop,nop,TS val 4117682 ecr 4117638], length 0
E..4X6@.?.....d...d......e. A5......(f.....
.>...>..
17:39:00.558385 IP 192.168.100.194.53163 > 192.168.100.130.telnet: Flags [P.], seq 161:163, ack 151, win 229, options [nop,nop,TS val 4119406 ecr 4117638], length 2
E..6X7@.@.....d...d......e. A5......J......
.>.n.>...
17:39:00.558632 IP 192.168.100.194.53163 > 192.168.100.130.telnet: Flags [P.], seq 161:163, ack 151, win 229, options [nop,nop,TS val 4119406 ecr 4117638], length 2
E..6X7@.?.....d...d......e. A5.............
.>.n.>...
17:39:00.565127 IP 192.168.100.130.telnet > 192.168.100.194.53163: Flags [P.], seq 151:153, ack 163, win 227, options [nop,nop,TS val 4119368 ecr 4119406], length 2
E..6.3@.@.....d...d.....A5...e."..........
.>.H.>.n

17:39:00.565236 IP 192.168.100.130.telnet > 192.168.100.194.53163: Flags [P.], seq 151:153, ack 163, win 227, options [nop,nop,TS val 4119368 ecr 4119406], length 2
E..6.3@.?.....d...d.....A5...e."..........
.>.H.>.n

17:39:00.565251 IP 192.168.100.194.53163 > 192.168.100.130.telnet: Flags [.], ack 153, win 229, options [nop,nop,TS val 4119413 ecr 4119368], length 0
E..4X8@.@.....d...d......e."A5.............
.>.u.>.H
17:39:00.565379 IP 192.168.100.194.53163 > 192.168.100.130.telnet: Flags [.], ack 153, win 229, options [nop,nop,TS val 4119413 ecr 4119368], length 0
E..4X8@.?.....d...d......e."A5.............
.>.u.>.H
17:39:00.578927 IP 192.168.100.130.telnet > 192.168.100.194.53163: Flags [P.], seq 153:163, ack 163, win 227, options [nop,nop,TS val 4119382 ecr 4119413], length 10
E..>.4@.@.....d...d.....A5...e."....2......
.>.V.>.uPassword: 
17:39:00.578935 IP 192.168.100.130.telnet > 192.168.100.194.53163: Flags [P.], seq 153:163, ack 163, win 227, options [nop,nop,TS val 4119382 ecr 4119413], length 10
E..>.4@.?.....d...d.....A5...e."....2......
.>.V.>.uPassword: 
17:39:00.578949 IP 192.168.100.194.53163 > 192.168.100.130.telnet: Flags [.], ack 163, win 229, options [nop,nop,TS val 4119426 ecr 4119382], length 0
E..4X9@.@.....d...d......e."A5.............
.>...>.V
17:39:00.579228 IP 192.168.100.194.53163 > 192.168.100.130.telnet: Flags [.], ack 163, win 229, options [nop,nop,TS val 4119426 ecr 4119382], length 0
E..4X9@.?.....d...d......e."A5.............
.>...>.V
17:39:01.454611 IP 192.168.100.194.53163 > 192.168.100.130.telnet: Flags [P.], seq 163:164, ack 163, win 229, options [nop,nop,TS val 4120302 ecr 4119382], length 1
E..5X:@.@.....d...d......e."A5......J......
.>...>.VO
17:39:01.454994 IP 192.168.100.194.53163 > 192.168.100.130.telnet: Flags [P.], seq 163:164, ack 163, win 229, options [nop,nop,TS val 4120302 ecr 4119382], length 1
E..5X:@.?.....d...d......e."A5.......B.....
.>...>.VO
17:39:01.494425 IP 192.168.100.130.telnet > 192.168.100.194.53163: Flags [.], ack 164, win 227, options [nop,nop,TS val 4120299 ecr 4120302], length 0
E..4.5@.@.....d...d.....A5...e.#...........
.>...>..
17:39:01.494752 IP 192.168.100.130.telnet > 192.168.100.194.53163: Flags [.], ack 164, win 227, options [nop,nop,TS val 4120299 ecr 4120302], length 0
E..4.5@.?.....d...d.....A5...e.#...........
.>...>..
17:39:01.718526 IP 192.168.100.194.53163 > 192.168.100.130.telnet: Flags [P.], seq 164:165, ack 163, win 229, options [nop,nop,TS val 4120566 ecr 4120299], length 1
E..5X;@.@.....d...d......e.#A5......J......
.>...>..b
17:39:01.718852 IP 192.168.100.194.53163 > 192.168.100.130.telnet: Flags [P.], seq 164:165, ack 163, win 229, options [nop,nop,TS val 4120566 ecr 4120299], length 1
E..5X;@.?.....d...d......e.#A5.............
.>...>..b
17:39:01.719032 IP 192.168.100.130.telnet > 192.168.100.194.53163: Flags [.], ack 165, win 227, options [nop,nop,TS val 4120523 ecr 4120566], length 0
E..4.6@.@.....d...d.....A5...e.$...........
.>...>..
17:39:01.719148 IP 192.168.100.130.telnet > 192.168.100.194.53163: Flags [.], ack 165, win 227, options [nop,nop,TS val 4120523 ecr 4120566], length 0
E..4.6@.?.....d...d.....A5...e.$...........
.>...>..
17:39:01.830451 IP 192.168.100.194.53163 > 192.168.100.130.telnet: Flags [P.], seq 165:166, ack 163, win 229, options [nop,nop,TS val 4120678 ecr 4120523], length 1
E..5X<@.@.....d...d......e.$A5......J......
.>.f.>..a
17:39:01.830809 IP 192.168.100.194.53163 > 192.168.100.130.telnet: Flags [P.], seq 165:166, ack 163, win 229, options [nop,nop,TS val 4120678 ecr 4120523], length 1
E..5X<@.?.....d...d......e.$A5.......S.....
.>.f.>..a
17:39:01.830991 IP 192.168.100.130.telnet > 192.168.100.194.53163: Flags [.], ack 166, win 227, options [nop,nop,TS val 4120635 ecr 4120678], length 0
E..4.7@.@.....d...d.....A5...e.%...........
.>.;.>.f
17:39:01.831112 IP 192.168.100.130.telnet > 192.168.100.194.53163: Flags [.], ack 166, win 227, options [nop,nop,TS val 4120635 ecr 4120678], length 0
E..4.7@.?.....d...d.....A5...e.%...........
.>.;.>.f
17:39:02.038472 IP 192.168.100.194.53163 > 192.168.100.130.telnet: Flags [P.], seq 166:167, ack 163, win 229, options [nop,nop,TS val 4120886 ecr 4120635], length 1
E..5X=@.@.....d...d......e.%A5......J......
.>.6.>.;m
17:39:02.038792 IP 192.168.100.194.53163 > 192.168.100.130.telnet: Flags [P.], seq 166:167, ack 163, win 229, options [nop,nop,TS val 4120886 ecr 4120635], length 1
E..5X=@.?.....d...d......e.%A5.............
.>.6.>.;m
17:39:02.038976 IP 192.168.100.130.telnet > 192.168.100.194.53163: Flags [.], ack 167, win 227, options [nop,nop,TS val 4120843 ecr 4120886], length 0
E..4.8@.@.....d...d.....A5...e.&.....M.....
.>...>.6
17:39:02.039098 IP 192.168.100.130.telnet > 192.168.100.194.53163: Flags [.], ack 167, win 227, options [nop,nop,TS val 4120843 ecr 4120886], length 0
E..4.8@.?.....d...d.....A5...e.&.....M.....
.>...>.6
17:39:02.166440 IP 192.168.100.194.53163 > 192.168.100.130.telnet: Flags [P.], seq 167:168, ack 163, win 229, options [nop,nop,TS val 4121014 ecr 4120843], length 1
E..5X>@.@.....d...d......e.&A5......J......
.>...>..a
17:39:02.166758 IP 192.168.100.194.53163 > 192.168.100.130.telnet: Flags [P.], seq 167:168, ack 163, win 229, options [nop,nop,TS val 4121014 ecr 4120843], length 1
E..5X>@.?.....d...d......e.&A5.............
.>...>..a
17:39:02.166938 IP 192.168.100.130.telnet > 192.168.100.194.53163: Flags [.], ack 168, win 227, options [nop,nop,TS val 4120971 ecr 4121014], length 0
E..4.9@.@.....d...d.....A5...e.'.....L.....
.>...>..
17:39:02.167103 IP 192.168.100.130.telnet > 192.168.100.194.53163: Flags [.], ack 168, win 227, options [nop,nop,TS val 4120971 ecr 4121014], length 0
E..4.9@.?.....d...d.....A5...e.'.....L.....
.>...>..
17:39:03.094567 IP 192.168.100.194.53163 > 192.168.100.130.telnet: Flags [P.], seq 168:169, ack 163, win 229, options [nop,nop,TS val 4121942 ecr 4120971], length 1
E..5X?@.@.....d...d......e.'A5......J......
.>.V.>..$
17:39:03.094915 IP 192.168.100.194.53163 > 192.168.100.130.telnet: Flags [P.], seq 168:169, ack 163, win 229, options [nop,nop,TS val 4121942 ecr 4120971], length 1
E..5X?@.?.....d...d......e.'A5.............
.>.V.>..$
17:39:03.095271 IP 192.168.100.130.telnet > 192.168.100.194.53163: Flags [.], ack 169, win 227, options [nop,nop,TS val 4121899 ecr 4121942], length 0
E..4.:@.@.....d...d.....A5...e.(...........
.>.+.>.V
17:39:03.095276 IP 192.168.100.130.telnet > 192.168.100.194.53163: Flags [.], ack 169, win 227, options [nop,nop,TS val 4121899 ecr 4121942], length 0
E..4.:@.?.....d...d.....A5...e.(...........
.>.+.>.V
17:39:04.150514 IP 192.168.100.194.53163 > 192.168.100.130.telnet: Flags [P.], seq 169:170, ack 163, win 229, options [nop,nop,TS val 4122998 ecr 4121899], length 1
E..5X@@.@.....d...d......e.(A5......J......
.>.v.>.+b
17:39:04.150880 IP 192.168.100.194.53163 > 192.168.100.130.telnet: Flags [P.], seq 169:170, ack 163, win 229, options [nop,nop,TS val 4122998 ecr 4121899], length 1
E..5X@@.?.....d...d......e.(A5.............
.>.v.>.+b
17:39:04.151062 IP 192.168.100.130.telnet > 192.168.100.194.53163: Flags [.], ack 170, win 227, options [nop,nop,TS val 4122955 ecr 4122998], length 0
E..4.;@.@.....d...d.....A5...e.)...........
.>.K.>.v
17:39:04.151195 IP 192.168.100.130.telnet > 192.168.100.194.53163: Flags [.], ack 170, win 227, options [nop,nop,TS val 4122955 ecr 4122998], length 0
E..4.;@.?.....d...d.....A5...e.)...........
.>.K.>.v
17:39:04.302476 IP 192.168.100.194.53163 > 192.168.100.130.telnet: Flags [P.], seq 170:171, ack 163, win 229, options [nop,nop,TS val 4123150 ecr 4122955], length 1
E..5XA@.@.....d...d......e.)A5......J......
.>...>.Ka
17:39:04.302795 IP 192.168.100.194.53163 > 192.168.100.130.telnet: Flags [P.], seq 170:171, ack 163, win 229, options [nop,nop,TS val 4123150 ecr 4122955], length 1
E..5XA@.?.....d...d......e.)A5.......&.....
.>...>.Ka
17:39:04.302976 IP 192.168.100.130.telnet > 192.168.100.194.53163: Flags [.], ack 171, win 227, options [nop,nop,TS val 4123107 ecr 4123150], length 0
E..4.<@.@.....d...d.....A5...e.*...........
.>...>..
17:39:04.303137 IP 192.168.100.130.telnet > 192.168.100.194.53163: Flags [.], ack 171, win 227, options [nop,nop,TS val 4123107 ecr 4123150], length 0
E..4.<@.?.....d...d.....A5...e.*...........
.>...>..
17:39:04.534526 IP 192.168.100.194.53163 > 192.168.100.130.telnet: Flags [P.], seq 171:172, ack 163, win 229, options [nop,nop,TS val 4123382 ecr 4123107], length 1
E..5XB@.@.....d...d......e.*A5......J......
.>...>..r
17:39:04.534865 IP 192.168.100.194.53163 > 192.168.100.130.telnet: Flags [P.], seq 171:172, ack 163, win 229, options [nop,nop,TS val 4123382 ecr 4123107], length 1
E..5XB@.?.....d...d......e.*A5.............
.>...>..r
17:39:04.535047 IP 192.168.100.130.telnet > 192.168.100.194.53163: Flags [.], ack 172, win 227, options [nop,nop,TS val 4123339 ecr 4123382], length 0
E..4.=@.@.....d...d.....A5...e.+...........
.>...>..
17:39:04.535222 IP 192.168.100.130.telnet > 192.168.100.194.53163: Flags [.], ack 172, win 227, options [nop,nop,TS val 4123339 ecr 4123382], length 0
E..4.=@.?.....d...d.....A5...e.+...........
.>...>..
17:39:04.702731 IP 192.168.100.194.53163 > 192.168.100.130.telnet: Flags [P.], seq 172:173, ack 163, win 229, options [nop,nop,TS val 4123550 ecr 4123339], length 1
E..5XC@.@.....d...d......e.+A5......J......
.>...>..r
17:39:04.703060 IP 192.168.100.194.53163 > 192.168.100.130.telnet: Flags [P.], seq 172:173, ack 163, win 229, options [nop,nop,TS val 4123550 ecr 4123339], length 1
E..5XC@.?.....d...d......e.+A5.............
.>...>..r
17:39:04.703242 IP 192.168.100.130.telnet > 192.168.100.194.53163: Flags [.], ack 173, win 227, options [nop,nop,TS val 4123507 ecr 4123550], length 0
E..4.>@.@.....d...d.....A5...e.,.....v.....
.>.s.>..
17:39:04.703402 IP 192.168.100.130.telnet > 192.168.100.194.53163: Flags [.], ack 173, win 227, options [nop,nop,TS val 4123507 ecr 4123550], length 0
E..4.>@.?.....d...d.....A5...e.,.....v.....
.>.s.>..
17:39:04.822477 IP 192.168.100.194.53163 > 192.168.100.130.telnet: Flags [P.], seq 173:174, ack 163, win 229, options [nop,nop,TS val 4123670 ecr 4123507], length 1
E..5XD@.@.....d...d......e.,A5......J......
.>...>.sa
17:39:04.822796 IP 192.168.100.194.53163 > 192.168.100.130.telnet: Flags [P.], seq 173:174, ack 163, win 229, options [nop,nop,TS val 4123670 ecr 4123507], length 1
E..5XD@.?.....d...d......e.,A5.............
.>...>.sa
17:39:04.823142 IP 192.168.100.130.telnet > 192.168.100.194.53163: Flags [.], ack 174, win 227, options [nop,nop,TS val 4123627 ecr 4123670], length 0
E..4.?@.@.....d...d.....A5...e.-...........
.>...>..
17:39:04.823147 IP 192.168.100.130.telnet > 192.168.100.194.53163: Flags [.], ack 174, win 227, options [nop,nop,TS val 4123627 ecr 4123670], length 0
E..4.?@.?.....d...d.....A5...e.-...........
.>...>..
17:39:05.054652 IP 192.168.100.194.53163 > 192.168.100.130.telnet: Flags [P.], seq 174:175, ack 163, win 229, options [nop,nop,TS val 4123902 ecr 4123627], length 1
E..5XE@.@.....d...d......e.-A5......J......
.>...>..c
17:39:05.055029 IP 192.168.100.194.53163 > 192.168.100.130.telnet: Flags [P.], seq 174:175, ack 163, win 229, options [nop,nop,TS val 4123902 ecr 4123627], length 1
E..5XE@.?.....d...d......e.-A5.............
.>...>..c
17:39:05.055233 IP 192.168.100.130.telnet > 192.168.100.194.53163: Flags [.], ack 175, win 227, options [nop,nop,TS val 4123859 ecr 4123902], length 0
E..4.@@.@.....d...d.....A5...e.............
.>...>..
17:39:05.055354 IP 192.168.100.130.telnet > 192.168.100.194.53163: Flags [.], ack 175, win 227, options [nop,nop,TS val 4123859 ecr 4123902], length 0
E..4.@@.?.....d...d.....A5...e.............
.>...>..
17:39:05.222438 IP 192.168.100.194.53163 > 192.168.100.130.telnet: Flags [P.], seq 175:176, ack 163, win 229, options [nop,nop,TS val 4124070 ecr 4123859], length 1
E..5XF@.@.....d...d......e..A5......J......
.>...>..k
17:39:05.222756 IP 192.168.100.194.53163 > 192.168.100.130.telnet: Flags [P.], seq 175:176, ack 163, win 229, options [nop,nop,TS val 4124070 ecr 4123859], length 1
E..5XF@.?.....d...d......e..A5.............
.>...>..k
17:39:05.222975 IP 192.168.100.130.telnet > 192.168.100.194.53163: Flags [.], ack 176, win 227, options [nop,nop,TS val 4124027 ecr 4124070], length 0
E..4.A@.@.....d...d.....A5...e./.....c.....
.>.{.>..
17:39:05.223097 IP 192.168.100.130.telnet > 192.168.100.194.53163: Flags [.], ack 176, win 227, options [nop,nop,TS val 4124027 ecr 4124070], length 0
E..4.A@.?.....d...d.....A5...e./.....c.....
.>.{.>..
17:39:05.457332 IP 192.168.100.194.53163 > 192.168.100.130.telnet: Flags [P.], seq 176:178, ack 163, win 229, options [nop,nop,TS val 4124305 ecr 4124027], length 2
E..6XG@.@.....d...d......e./A5......J......
.>...>.{.
17:39:05.457552 IP 192.168.100.194.53163 > 192.168.100.130.telnet: Flags [P.], seq 176:178, ack 163, win 229, options [nop,nop,TS val 4124305 ecr 4124027], length 2
E..6XG@.?.....d...d......e./A5.......l.....
.>...>.{.
17:39:05.457628 IP 192.168.100.130.telnet > 192.168.100.194.53163: Flags [.], ack 178, win 227, options [nop,nop,TS val 4124262 ecr 4124305], length 0
E..4.B@.@.....d...d.....A5...e.1...........
.>.f.>..
17:39:05.457746 IP 192.168.100.130.telnet > 192.168.100.194.53163: Flags [.], ack 178, win 227, options [nop,nop,TS val 4124262 ecr 4124305], length 0
E..4.B@.?.....d...d.....A5...e.1...........
.>.f.>..
17:39:05.465211 IP 192.168.100.130.telnet > 192.168.100.194.53163: Flags [P.], seq 163:165, ack 178, win 227, options [nop,nop,TS val 4124269 ecr 4124305], length 2
E..6.C@.@.....d...d.....A5...e.1.....p.....
.>.m.>..

17:39:05.465286 IP 192.168.100.130.telnet > 192.168.100.194.53163: Flags [P.], seq 163:165, ack 178, win 227, options [nop,nop,TS val 4124269 ecr 4124305], length 2
E..6.C@.?.....d...d.....A5...e.1.....p.....
.>.m.>..

17:39:05.465294 IP 192.168.100.194.53163 > 192.168.100.130.telnet: Flags [.], ack 165, win 229, options [nop,nop,TS val 4124313 ecr 4124269], length 0
E..4XH@.@.....d...d......e.1A5.......x.....
.>...>.m
17:39:05.465415 IP 192.168.100.194.53163 > 192.168.100.130.telnet: Flags [.], ack 165, win 229, options [nop,nop,TS val 4124313 ecr 4124269], length 0
E..4XH@.?.....d...d......e.1A5.......x.....
.>...>.m
17:39:07.590790 IP 192.168.100.130.telnet > 192.168.100.194.53163: Flags [P.], seq 165:184, ack 178, win 227, options [nop,nop,TS val 4126392 ecr 4124313], length 19
E..G.D@.@.....d...d.....A5...e.1.....M.....
.>...>..Login incorrect


17:39:07.590990 IP 192.168.100.130.telnet > 192.168.100.194.53163: Flags [P.], seq 165:184, ack 178, win 227, options [nop,nop,TS val 4126392 ecr 4124313], length 19
E..G.D@.?.....d...d.....A5...e.1.....M.....
.>...>..Login incorrect


17:39:07.591017 IP 192.168.100.194.53163 > 192.168.100.130.telnet: Flags [.], ack 184, win 229, options [nop,nop,TS val 4126438 ecr 4126392], length 0
E..4XI@.@.....d...d......e.1A5.............
.>...>..
17:39:07.591466 IP 192.168.100.194.53163 > 192.168.100.130.telnet: Flags [.], ack 184, win 229, options [nop,nop,TS val 4126438 ecr 4126392], length 0
E..4XI@.?.....d...d......e.1A5.............
.>...>..
17:39:07.591693 IP 192.168.100.130.telnet > 192.168.100.194.53163: Flags [P.], seq 184:191, ack 178, win 227, options [nop,nop,TS val 4126396 ecr 4126438], length 7
E..;.E@.@.....d...d.....A5...e.1...........
.>...>..login: 
17:39:07.591890 IP 192.168.100.130.telnet > 192.168.100.194.53163: Flags [P.], seq 184:191, ack 178, win 227, options [nop,nop,TS val 4126396 ecr 4126438], length 7
E..;.E@.?.....d...d.....A5...e.1...........
.>...>..login: 
17:39:07.591901 IP 192.168.100.194.53163 > 192.168.100.130.telnet: Flags [.], ack 191, win 229, options [nop,nop,TS val 4126439 ecr 4126396], length 0
E..4XJ@.@.....d...d......e.1A5.............
.>...>..
17:39:07.592329 IP 192.168.100.194.53163 > 192.168.100.130.telnet: Flags [.], ack 191, win 229, options [nop,nop,TS val 4126439 ecr 4126396], length 0
E..4XJ@.?.....d...d......e.1A5.............
.>...>..
17:39:10.166433 IP 192.168.100.194.53163 > 192.168.100.130.telnet: Flags [P.], seq 178:179, ack 191, win 229, options [nop,nop,TS val 4129014 ecr 4126396], length 1
E..5XK@.@.....d...d......e.1A5......J......
.?...>..C
17:39:10.166774 IP 192.168.100.194.53163 > 192.168.100.130.telnet: Flags [P.], seq 178:179, ack 191, win 229, options [nop,nop,TS val 4129014 ecr 4126396], length 1
E..5XK@.?.....d...d......e.1A5.............
.?...>..C
17:39:10.172957 IP 192.168.100.130.telnet > 192.168.100.194.53163: Flags [P.], seq 191:192, ack 179, win 227, options [nop,nop,TS val 4128977 ecr 4129014], length 1
E..5.F@.@.....d...d.....A5...e.2...........
.?...?..C
17:39:10.173152 IP 192.168.100.130.telnet > 192.168.100.194.53163: Flags [P.], seq 191:192, ack 179, win 227, options [nop,nop,TS val 4128977 ecr 4129014], length 1
E..5.F@.?.....d...d.....A5...e.2...........
.?...?..C
17:39:10.173175 IP 192.168.100.194.53163 > 192.168.100.130.telnet: Flags [.], ack 192, win 229, options [nop,nop,TS val 4129021 ecr 4128977], length 0
E..4XL@.@.....d...d......e.2A5.............
.?...?..
17:39:10.173502 IP 192.168.100.194.53163 > 192.168.100.130.telnet: Flags [.], ack 192, win 229, options [nop,nop,TS val 4129021 ecr 4128977], length 0
E..4XL@.?.....d...d......e.2A5.............
.?...?..
17:39:10.470541 IP 192.168.100.194.53163 > 192.168.100.130.telnet: Flags [P.], seq 179:180, ack 192, win 229, options [nop,nop,TS val 4129318 ecr 4128977], length 1
E..5XM@.@.....d...d......e.2A5......J......
.?.&.?..l
17:39:10.470876 IP 192.168.100.194.53163 > 192.168.100.130.telnet: Flags [P.], seq 179:180, ack 192, win 229, options [nop,nop,TS val 4129318 ecr 4128977], length 1
E..5XM@.?.....d...d......e.2A5......bb.....
.?.&.?..l
17:39:10.475188 IP 192.168.100.130.telnet > 192.168.100.194.53163: Flags [P.], seq 192:193, ack 180, win 227, options [nop,nop,TS val 4129279 ecr 4129318], length 1
E..5.G@.@.....d...d.....A5...e.3....a5.....
.?...?.&l
17:39:10.475383 IP 192.168.100.130.telnet > 192.168.100.194.53163: Flags [P.], seq 192:193, ack 180, win 227, options [nop,nop,TS val 4129279 ecr 4129318], length 1
E..5.G@.?.....d...d.....A5...e.3....a5.....
.?...?.&l
17:39:10.475404 IP 192.168.100.194.53163 > 192.168.100.130.telnet: Flags [.], ack 193, win 229, options [nop,nop,TS val 4129323 ecr 4129279], length 0
E..4XN@.@.....d...d......e.3A5.......6.....
.?.+.?..
17:39:10.475729 IP 192.168.100.194.53163 > 192.168.100.130.telnet: Flags [.], ack 193, win 229, options [nop,nop,TS val 4129323 ecr 4129279], length 0
E..4XN@.?.....d...d......e.3A5.......6.....
.?.+.?..
17:39:10.598417 IP 192.168.100.194.53163 > 192.168.100.130.telnet: Flags [P.], seq 180:181, ack 193, win 229, options [nop,nop,TS val 4129446 ecr 4129279], length 1
E..5XO@.@.....d...d......e.3A5......J......
.?...?..i
17:39:10.598747 IP 192.168.100.194.53163 > 192.168.100.130.telnet: Flags [P.], seq 180:181, ack 193, win 229, options [nop,nop,TS val 4129446 ecr 4129279], length 1
E..5XO@.?.....d...d......e.3A5......c......
.?...?..i
17:39:10.604092 IP 192.168.100.130.telnet > 192.168.100.194.53163: Flags [P.], seq 193:194, ack 181, win 227, options [nop,nop,TS val 4129408 ecr 4129446], length 1
E..5.H@.@.....d...d.....A5...e.4....c2.....
.?...?..i
17:39:10.605553 IP 192.168.100.130.telnet > 192.168.100.194.53163: Flags [P.], seq 193:194, ack 181, win 227, options [nop,nop,TS val 4129408 ecr 4129446], length 1
E..5.H@.?.....d...d.....A5...e.4....c2.....
.?...?..i
17:39:10.605572 IP 192.168.100.194.53163 > 192.168.100.130.telnet: Flags [.], ack 194, win 229, options [nop,nop,TS val 4129453 ecr 4129408], length 0
E..4XP@.@.....d...d......e.4A5.......1.....
.?...?..
17:39:10.605889 IP 192.168.100.194.53163 > 192.168.100.130.telnet: Flags [.], ack 194, win 229, options [nop,nop,TS val 4129453 ecr 4129408], length 0
E..4XP@.?.....d...d......e.4A5.......1.....
.?...?..
17:39:10.774540 IP 192.168.100.194.53163 > 192.168.100.130.telnet: Flags [P.], seq 181:182, ack 194, win 229, options [nop,nop,TS val 4129622 ecr 4129408], length 1
E..5XQ@.@.....d...d......e.4A5......J......
.?.V.?..n
17:39:10.774917 IP 192.168.100.194.53163 > 192.168.100.130.telnet: Flags [P.], seq 181:182, ack 194, win 229, options [nop,nop,TS val 4129622 ecr 4129408], length 1
E..5XQ@.?.....d...d......e.4A5......]......
.?.V.?..n
17:39:10.783765 IP 192.168.100.130.telnet > 192.168.100.194.53163: Flags [P.], seq 194:195, ack 182, win 227, options [nop,nop,TS val 4129588 ecr 4129622], length 1
E..5.I@.@.....d...d.....A5...e.5....\......
.?.4.?.Vn
17:39:10.783913 IP 192.168.100.130.telnet > 192.168.100.194.53163: Flags [P.], seq 194:195, ack 182, win 227, options [nop,nop,TS val 4129588 ecr 4129622], length 1
E..5.I@.?.....d...d.....A5...e.5....\......
.?.4.?.Vn
17:39:10.783933 IP 192.168.100.194.53163 > 192.168.100.130.telnet: Flags [.], ack 195, win 229, options [nop,nop,TS val 4129631 ecr 4129588], length 0
E..4XR@.@.....d...d......e.5A5.............
.?._.?.4
17:39:10.784131 IP 192.168.100.194.53163 > 192.168.100.130.telnet: Flags [.], ack 195, win 229, options [nop,nop,TS val 4129631 ecr 4129588], length 0
E..4XR@.?.....d...d......e.5A5.............
.?._.?.4
17:39:10.934467 IP 192.168.100.194.53163 > 192.168.100.130.telnet: Flags [P.], seq 182:183, ack 195, win 229, options [nop,nop,TS val 4129782 ecr 4129588], length 1
E..5XS@.@.....d...d......e.5A5......J......
.?...?.4t
17:39:10.934802 IP 192.168.100.194.53163 > 192.168.100.130.telnet: Flags [P.], seq 182:183, ack 195, win 229, options [nop,nop,TS val 4129782 ecr 4129588], length 1
E..5XS@.?.....d...d......e.5A5......V).....
.?...?.4t
17:39:10.940038 IP 192.168.100.130.telnet > 192.168.100.194.53163: Flags [P.], seq 195:196, ack 183, win 227, options [nop,nop,TS val 4129744 ecr 4129782], length 1
E..5.J@.@.....d...d.....A5...e.6....U......
.?...?..t
17:39:10.940183 IP 192.168.100.130.telnet > 192.168.100.194.53163: Flags [P.], seq 195:196, ack 183, win 227, options [nop,nop,TS val 4129744 ecr 4129782], length 1
E..5.J@.?.....d...d.....A5...e.6....U......
.?...?..t
17:39:10.940200 IP 192.168.100.194.53163 > 192.168.100.130.telnet: Flags [.], ack 196, win 229, options [nop,nop,TS val 4129788 ecr 4129744], length 0
E..4XT@.@.....d...d......e.6A5.............
.?...?..
17:39:10.940440 IP 192.168.100.194.53163 > 192.168.100.130.telnet: Flags [.], ack 196, win 229, options [nop,nop,TS val 4129788 ecr 4129744], length 0
E..4XT@.?.....d...d......e.6A5.............
.?...?..
17:39:11.022408 IP 192.168.100.194.53163 > 192.168.100.130.telnet: Flags [P.], seq 183:184, ack 196, win 229, options [nop,nop,TS val 4129870 ecr 4129744], length 1
E..5XU@.@.....d...d......e.6A5......J......
.?.N.?..o
17:39:11.022859 IP 192.168.100.194.53163 > 192.168.100.130.telnet: Flags [P.], seq 183:184, ack 196, win 229, options [nop,nop,TS val 4129870 ecr 4129744], length 1
E..5XU@.?.....d...d......e.6A5......Z3.....
.?.N.?..o
17:39:11.029875 IP 192.168.100.130.telnet > 192.168.100.194.53163: Flags [P.], seq 196:197, ack 184, win 227, options [nop,nop,TS val 4129834 ecr 4129870], length 1
E..5.K@.@.....d...d.....A5...e.7....Y......
.?.*.?.No
17:39:11.030069 IP 192.168.100.130.telnet > 192.168.100.194.53163: Flags [P.], seq 196:197, ack 184, win 227, options [nop,nop,TS val 4129834 ecr 4129870], length 1
E..5.K@.?.....d...d.....A5...e.7....Y......
.?.*.?.No
17:39:11.030087 IP 192.168.100.194.53163 > 192.168.100.130.telnet: Flags [.], ack 197, win 229, options [nop,nop,TS val 4129877 ecr 4129834], length 0
E..4XV@.@.....d...d......e.7A5.............
.?.U.?.*
17:39:11.030414 IP 192.168.100.194.53163 > 192.168.100.130.telnet: Flags [.], ack 197, win 229, options [nop,nop,TS val 4129877 ecr 4129834], length 0
E..4XV@.?.....d...d......e.7A5.............
.?.U.?.*
17:39:11.182404 IP 192.168.100.194.53163 > 192.168.100.130.telnet: Flags [P.], seq 184:185, ack 197, win 229, options [nop,nop,TS val 4130030 ecr 4129834], length 1
E..5XW@.@.....d...d......e.7A5......J......
.?...?.*n
17:39:11.182714 IP 192.168.100.194.53163 > 192.168.100.130.telnet: Flags [P.], seq 184:185, ack 197, win 229, options [nop,nop,TS val 4130030 ecr 4129834], length 1
E..5XW@.?.....d...d......e.7A5......Z7.....
.?...?.*n
17:39:11.190011 IP 192.168.100.130.telnet > 192.168.100.194.53163: Flags [P.], seq 197:198, ack 185, win 227, options [nop,nop,TS val 4129994 ecr 4130030], length 1
E..5.L@.@.....d...d.....A5...e.8....Y......
.?...?..n
17:39:11.190206 IP 192.168.100.130.telnet > 192.168.100.194.53163: Flags [P.], seq 197:198, ack 185, win 227, options [nop,nop,TS val 4129994 ecr 4130030], length 1
E..5.L@.?.....d...d.....A5...e.8....Y......
.?...?..n
17:39:11.190223 IP 192.168.100.194.53163 > 192.168.100.130.telnet: Flags [.], ack 198, win 229, options [nop,nop,TS val 4130038 ecr 4129994], length 0
E..4XX@.@.....d...d......e.8A5.............
.?...?..
17:39:11.190548 IP 192.168.100.194.53163 > 192.168.100.130.telnet: Flags [.], ack 198, win 229, options [nop,nop,TS val 4130038 ecr 4129994], length 0
E..4XX@.?.....d...d......e.8A5.............
.?...?..
17:39:11.598160 IP 192.168.100.194.53163 > 192.168.100.130.telnet: Flags [P.], seq 185:187, ack 198, win 229, options [nop,nop,TS val 4130446 ecr 4129994], length 2
E..6XY@.@.....d...d......e.8A5......J......
.?...?...
17:39:11.598383 IP 192.168.100.194.53163 > 192.168.100.130.telnet: Flags [P.], seq 185:187, ack 198, win 229, options [nop,nop,TS val 4130446 ecr 4129994], length 2
E..6XY@.?.....d...d......e.8A5.............
.?...?...
17:39:11.601282 IP 192.168.100.130.telnet > 192.168.100.194.53163: Flags [P.], seq 198:200, ack 187, win 227, options [nop,nop,TS val 4130406 ecr 4130446], length 2
E..6.M@.@.....d...d.....A5...e.:.....N.....
.?.f.?..

17:39:11.601362 IP 192.168.100.130.telnet > 192.168.100.194.53163: Flags [P.], seq 198:200, ack 187, win 227, options [nop,nop,TS val 4130406 ecr 4130446], length 2
E..6.M@.?.....d...d.....A5...e.:.....N.....
.?.f.?..

17:39:11.601375 IP 192.168.100.194.53163 > 192.168.100.130.telnet: Flags [.], ack 200, win 229, options [nop,nop,TS val 4130449 ecr 4130406], length 0
E..4XZ@.@.....d...d......e.:A5.......[.....
.?...?.f
17:39:11.601495 IP 192.168.100.194.53163 > 192.168.100.130.telnet: Flags [.], ack 200, win 229, options [nop,nop,TS val 4130449 ecr 4130406], length 0
E..4XZ@.?.....d...d......e.:A5.......[.....
.?...?.f
17:39:11.608838 IP 192.168.100.130.telnet > 192.168.100.194.53163: Flags [P.], seq 200:210, ack 187, win 227, options [nop,nop,TS val 4130412 ecr 4130449], length 10
E..>.N@.@.....d...d.....A5...e.:.....|.....
.?.l.?..Password: 
17:39:11.608904 IP 192.168.100.130.telnet > 192.168.100.194.53163: Flags [P.], seq 200:210, ack 187, win 227, options [nop,nop,TS val 4130412 ecr 4130449], length 10
E..>.N@.?.....d...d.....A5...e.:.....|.....
.?.l.?..Password: 
17:39:11.608909 IP 192.168.100.194.53163 > 192.168.100.130.telnet: Flags [.], ack 210, win 229, options [nop,nop,TS val 4130456 ecr 4130412], length 0
E..4X[@.@.....d...d......e.:A5.......D.....
.?...?.l
17:39:11.609026 IP 192.168.100.194.53163 > 192.168.100.130.telnet: Flags [.], ack 210, win 229, options [nop,nop,TS val 4130456 ecr 4130412], length 0
E..4X[@.?.....d...d......e.:A5.......D.....
.?...?.l
17:39:12.226185 IP 192.168.100.194.53163 > 192.168.100.130.telnet: Flags [P.], seq 187:188, ack 210, win 229, options [nop,nop,TS val 4131074 ecr 4130412], length 1
E..5X\@.@.....d...d......e.:A5......J......
.?	..?.lO
17:39:12.226530 IP 192.168.100.194.53163 > 192.168.100.130.telnet: Flags [P.], seq 187:188, ack 210, win 229, options [nop,nop,TS val 4131074 ecr 4130412], length 1
E..5X\@.?.....d...d......e.:A5......r......
.?	..?.lO
17:39:12.269303 IP 192.168.100.130.telnet > 192.168.100.194.53163: Flags [.], ack 188, win 227, options [nop,nop,TS val 4131074 ecr 4131074], length 0
E..4.O@.@.....d...d.....A5...e.;.....E.....
.?	..?	.
17:39:12.269497 IP 192.168.100.130.telnet > 192.168.100.194.53163: Flags [.], ack 188, win 227, options [nop,nop,TS val 4131074 ecr 4131074], length 0
E..4.O@.?.....d...d.....A5...e.;.....E.....
.?	..?	.
17:39:12.470567 IP 192.168.100.194.53163 > 192.168.100.130.telnet: Flags [P.], seq 188:189, ack 210, win 229, options [nop,nop,TS val 4131318 ecr 4131074], length 1
E..5X]@.@.....d...d......e.;A5......J......
.?	..?	.b
17:39:12.470912 IP 192.168.100.194.53163 > 192.168.100.130.telnet: Flags [P.], seq 188:189, ack 210, win 229, options [nop,nop,TS val 4131318 ecr 4131074], length 1
E..5X]@.?.....d...d......e.;A5......\F.....
.?	..?	.b
17:39:12.471140 IP 192.168.100.130.telnet > 192.168.100.194.53163: Flags [.], ack 189, win 227, options [nop,nop,TS val 4131275 ecr 4131318], length 0
E..4.P@.@.....d...d.....A5...e.<...........
.?	..?	.
17:39:12.471276 IP 192.168.100.130.telnet > 192.168.100.194.53163: Flags [.], ack 189, win 227, options [nop,nop,TS val 4131275 ecr 4131318], length 0
E..4.P@.?.....d...d.....A5...e.<...........
.?	..?	.
17:39:12.630429 IP 192.168.100.194.53163 > 192.168.100.130.telnet: Flags [P.], seq 189:190, ack 210, win 229, options [nop,nop,TS val 4131478 ecr 4131275], length 1
E..5X^@.@.....d...d......e.<A5......J......
.?
..?	.a
17:39:12.630749 IP 192.168.100.194.53163 > 192.168.100.130.telnet: Flags [P.], seq 189:190, ack 210, win 229, options [nop,nop,TS val 4131478 ecr 4131275], length 1
E..5X^@.?.....d...d......e.<A5......[......
.?
..?	.a
17:39:12.630927 IP 192.168.100.130.telnet > 192.168.100.194.53163: Flags [.], ack 190, win 227, options [nop,nop,TS val 4131435 ecr 4131478], length 0
E..4.Q@.@.....d...d.....A5...e.=.....F.....
.?
k.?
.
17:39:12.631048 IP 192.168.100.130.telnet > 192.168.100.194.53163: Flags [.], ack 190, win 227, options [nop,nop,TS val 4131435 ecr 4131478], length 0
E..4.Q@.?.....d...d.....A5...e.=.....F.....
.?
k.?
.
17:39:12.830799 IP 192.168.100.194.53163 > 192.168.100.130.telnet: Flags [P.], seq 190:191, ack 210, win 229, options [nop,nop,TS val 4131678 ecr 4131435], length 1
E..5X_@.@.....d...d......e.=A5......J......
.?.^.?
km
17:39:12.831118 IP 192.168.100.194.53163 > 192.168.100.130.telnet: Flags [P.], seq 190:191, ack 210, win 229, options [nop,nop,TS val 4131678 ecr 4131435], length 1
E..5X_@.?.....d...d......e.=A5......Ns.....
.?.^.?
km
17:39:12.831318 IP 192.168.100.130.telnet > 192.168.100.194.53163: Flags [.], ack 191, win 227, options [nop,nop,TS val 4131636 ecr 4131678], length 0
E..4.R@.@.....d...d.....A5...e.>...........
.?.4.?.^
17:39:12.831439 IP 192.168.100.130.telnet > 192.168.100.194.53163: Flags [.], ack 191, win 227, options [nop,nop,TS val 4131636 ecr 4131678], length 0
E..4.R@.?.....d...d.....A5...e.>...........
.?.4.?.^
17:39:12.950390 IP 192.168.100.194.53163 > 192.168.100.130.telnet: Flags [P.], seq 191:192, ack 210, win 229, options [nop,nop,TS val 4131798 ecr 4131636], length 1
E..5X`@.@.....d...d......e.>A5......J......
.?...?.4a
17:39:12.950720 IP 192.168.100.194.53163 > 192.168.100.130.telnet: Flags [P.], seq 191:192, ack 210, win 229, options [nop,nop,TS val 4131798 ecr 4131636], length 1
E..5X`@.?.....d...d......e.>A5......Y1.....
.?...?.4a
17:39:12.951107 IP 192.168.100.130.telnet > 192.168.100.194.53163: Flags [.], ack 192, win 227, options [nop,nop,TS val 4131755 ecr 4131798], length 0
E..4.S@.@.....d...d.....A5...e.?...........
.?...?..
17:39:12.951112 IP 192.168.100.130.telnet > 192.168.100.194.53163: Flags [.], ack 192, win 227, options [nop,nop,TS val 4131755 ecr 4131798], length 0
E..4.S@.?.....d...d.....A5...e.?...........
.?...?..
17:39:13.710390 IP 192.168.100.194.53163 > 192.168.100.130.telnet: Flags [P.], seq 192:193, ack 210, win 229, options [nop,nop,TS val 4132558 ecr 4131755], length 1
E..5Xa@.@.....d...d......e.?A5......J......
.?...?..$
17:39:13.710741 IP 192.168.100.194.53163 > 192.168.100.130.telnet: Flags [P.], seq 192:193, ack 210, win 229, options [nop,nop,TS val 4132558 ecr 4131755], length 1
E..5Xa@.?.....d...d......e.?A5.............
.?...?..$
17:39:13.710930 IP 192.168.100.130.telnet > 192.168.100.194.53163: Flags [.], ack 193, win 227, options [nop,nop,TS val 4132515 ecr 4132558], length 0
E..4.T@.@.....d...d.....A5...e.@...........
.?...?..
17:39:13.711104 IP 192.168.100.130.telnet > 192.168.100.194.53163: Flags [.], ack 193, win 227, options [nop,nop,TS val 4132515 ecr 4132558], length 0
E..4.T@.?.....d...d.....A5...e.@...........
.?...?..
17:39:13.862322 IP 192.168.100.194.53163 > 192.168.100.130.telnet: Flags [P.], seq 193:194, ack 210, win 229, options [nop,nop,TS val 4132710 ecr 4132515], length 1
E..5Xb@.@.....d...d......e.@A5......J......
.?.f.?..$
17:39:13.862638 IP 192.168.100.194.53163 > 192.168.100.130.telnet: Flags [P.], seq 193:194, ack 210, win 229, options [nop,nop,TS val 4132710 ecr 4132515], length 1
E..5Xb@.?.....d...d......e.@A5.......0.....
.?.f.?..$
17:39:13.862817 IP 192.168.100.130.telnet > 192.168.100.194.53163: Flags [.], ack 194, win 227, options [nop,nop,TS val 4132667 ecr 4132710], length 0
E..4.U@.@.....d...d.....A5...e.A...........
.?.;.?.f
17:39:13.862967 IP 192.168.100.130.telnet > 192.168.100.194.53163: Flags [.], ack 194, win 227, options [nop,nop,TS val 4132667 ecr 4132710], length 0
E..4.U@.?.....d...d.....A5...e.A...........
.?.;.?.f
17:39:14.086364 IP 192.168.100.194.53163 > 192.168.100.130.telnet: Flags [P.], seq 194:195, ack 210, win 229, options [nop,nop,TS val 4132934 ecr 4132667], length 1
E..5Xc@.@.....d...d......e.AA5......J......
.?.F.?.;b
17:39:14.086738 IP 192.168.100.194.53163 > 192.168.100.130.telnet: Flags [P.], seq 194:195, ack 210, win 229, options [nop,nop,TS val 4132934 ecr 4132667], length 1
E..5Xc@.?.....d...d......e.AA5......O......
.?.F.?.;b
17:39:14.086893 IP 192.168.100.130.telnet > 192.168.100.194.53163: Flags [.], ack 195, win 227, options [nop,nop,TS val 4132891 ecr 4132934], length 0
E..4.V@.@.....d...d.....A5...e.B...........
.?...?.F
17:39:14.087012 IP 192.168.100.130.telnet > 192.168.100.194.53163: Flags [.], ack 195, win 227, options [nop,nop,TS val 4132891 ecr 4132934], length 0
E..4.V@.?.....d...d.....A5...e.B...........
.?...?.F
17:39:14.214309 IP 192.168.100.194.53163 > 192.168.100.130.telnet: Flags [P.], seq 195:196, ack 210, win 229, options [nop,nop,TS val 4133062 ecr 4132891], length 1
E..5Xd@.@.....d...d......e.BA5......J......
.?...?..a
17:39:14.214629 IP 192.168.100.194.53163 > 192.168.100.130.telnet: Flags [P.], seq 195:196, ack 210, win 229, options [nop,nop,TS val 4133062 ecr 4132891], length 1
E..5Xd@.?.....d...d......e.BA5......OV.....
.?...?..a
17:39:14.214808 IP 192.168.100.130.telnet > 192.168.100.194.53163: Flags [.], ack 196, win 227, options [nop,nop,TS val 4133019 ecr 4133062], length 0
E..4.W@.@.....d...d.....A5...e.C...........
.?...?..
17:39:14.214939 IP 192.168.100.130.telnet > 192.168.100.194.53163: Flags [.], ack 196, win 227, options [nop,nop,TS val 4133019 ecr 4133062], length 0
E..4.W@.?.....d...d.....A5...e.C...........
.?...?..
17:39:14.446263 IP 192.168.100.194.53163 > 192.168.100.130.telnet: Flags [P.], seq 196:197, ack 210, win 229, options [nop,nop,TS val 4133294 ecr 4133019], length 1
E..5Xe@.@.....d...d......e.CA5......J......
.?...?..r
17:39:14.446930 IP 192.168.100.194.53163 > 192.168.100.130.telnet: Flags [P.], seq 196:197, ack 210, win 229, options [nop,nop,TS val 4133294 ecr 4133019], length 1
E..5Xe@.?.....d...d......e.CA5......<......
.?...?..r
17:39:14.446935 IP 192.168.100.130.telnet > 192.168.100.194.53163: Flags [.], ack 197, win 227, options [nop,nop,TS val 4133251 ecr 4133294], length 0
E..4.X@.@.....d...d.....A5...e.D...........
.?...?..
17:39:14.446937 IP 192.168.100.130.telnet > 192.168.100.194.53163: Flags [.], ack 197, win 227, options [nop,nop,TS val 4133251 ecr 4133294], length 0
E..4.X@.?.....d...d.....A5...e.D...........
.?...?..
17:39:14.598315 IP 192.168.100.194.53163 > 192.168.100.130.telnet: Flags [P.], seq 197:198, ack 210, win 229, options [nop,nop,TS val 4133446 ecr 4133251], length 1
E..5Xf@.@.....d...d......e.DA5......J......
.?.F.?..r
17:39:14.598644 IP 192.168.100.194.53163 > 192.168.100.130.telnet: Flags [P.], seq 197:198, ack 210, win 229, options [nop,nop,TS val 4133446 ecr 4133251], length 1
E..5Xf@.?.....d...d......e.DA5......;l.....
.?.F.?..r
17:39:14.598842 IP 192.168.100.130.telnet > 192.168.100.194.53163: Flags [.], ack 198, win 227, options [nop,nop,TS val 4133403 ecr 4133446], length 0
E..4.Y@.@.....d...d.....A5...e.E...........
.?...?.F
17:39:14.598964 IP 192.168.100.130.telnet > 192.168.100.194.53163: Flags [.], ack 198, win 227, options [nop,nop,TS val 4133403 ecr 4133446], length 0
E..4.Y@.?.....d...d.....A5...e.E...........
.?...?.F
17:39:14.726411 IP 192.168.100.194.53163 > 192.168.100.130.telnet: Flags [P.], seq 198:199, ack 210, win 229, options [nop,nop,TS val 4133574 ecr 4133403], length 1
E..5Xg@.@.....d...d......e.EA5......J......
.?...?..a
17:39:14.726735 IP 192.168.100.194.53163 > 192.168.100.130.telnet: Flags [P.], seq 198:199, ack 210, win 229, options [nop,nop,TS val 4133574 ecr 4133403], length 1
E..5Xg@.?.....d...d......e.EA5......KS.....
.?...?..a
17:39:14.726915 IP 192.168.100.130.telnet > 192.168.100.194.53163: Flags [.], ack 199, win 227, options [nop,nop,TS val 4133531 ecr 4133574], length 0
E..4.Z@.@.....d...d.....A5...e.F...........
.?...?..
17:39:14.727075 IP 192.168.100.130.telnet > 192.168.100.194.53163: Flags [.], ack 199, win 227, options [nop,nop,TS val 4133531 ecr 4133574], length 0
E..4.Z@.?.....d...d.....A5...e.F...........
.?...?..
17:39:14.998363 IP 192.168.100.194.53163 > 192.168.100.130.telnet: Flags [P.], seq 199:200, ack 210, win 229, options [nop,nop,TS val 4133846 ecr 4133531], length 1
E..5Xh@.@.....d...d......e.FA5......J......
.?...?..c
17:39:14.998678 IP 192.168.100.194.53163 > 192.168.100.130.telnet: Flags [P.], seq 199:200, ack 210, win 229, options [nop,nop,TS val 4133846 ecr 4133531], length 1
E..5Xh@.?.....d...d......e.FA5......G......
.?...?..c
17:39:14.998864 IP 192.168.100.130.telnet > 192.168.100.194.53163: Flags [.], ack 200, win 227, options [nop,nop,TS val 4133803 ecr 4133846], length 0
E..4.[@.@.....d...d.....A5...e.G...........
.?...?..
17:39:14.998989 IP 192.168.100.130.telnet > 192.168.100.194.53163: Flags [.], ack 200, win 227, options [nop,nop,TS val 4133803 ecr 4133846], length 0
E..4.[@.?.....d...d.....A5...e.G...........
.?...?..
17:39:15.134462 IP 192.168.100.194.53163 > 192.168.100.130.telnet: Flags [P.], seq 200:201, ack 210, win 229, options [nop,nop,TS val 4133982 ecr 4133803], length 1
E..5Xi@.@.....d...d......e.GA5......J......
.?.^.?..k
17:39:15.134780 IP 192.168.100.194.53163 > 192.168.100.130.telnet: Flags [P.], seq 200:201, ack 210, win 229, options [nop,nop,TS val 4133982 ecr 4133803], length 1
E..5Xi@.?.....d...d......e.GA5......>).....
.?.^.?..k
17:39:15.134958 IP 192.168.100.130.telnet > 192.168.100.194.53163: Flags [.], ack 201, win 227, options [nop,nop,TS val 4133939 ecr 4133982], length 0
E..4.\@.@.....d...d.....A5...e.H...........
.?.3.?.^
17:39:15.135075 IP 192.168.100.130.telnet > 192.168.100.194.53163: Flags [.], ack 201, win 227, options [nop,nop,TS val 4133939 ecr 4133982], length 0
E..4.\@.?.....d...d.....A5...e.H...........
.?.3.?.^
17:39:15.337553 IP 192.168.100.194.53163 > 192.168.100.130.telnet: Flags [P.], seq 201:203, ack 210, win 229, options [nop,nop,TS val 4134185 ecr 4133939], length 2
E..6Xj@.@.....d...d......e.HA5......J......
.?.).?.3.
17:39:15.337772 IP 192.168.100.194.53163 > 192.168.100.130.telnet: Flags [P.], seq 201:203, ack 210, win 229, options [nop,nop,TS val 4134185 ecr 4133939], length 2
E..6Xj@.?.....d...d......e.HA5.............
.?.).?.3.
17:39:15.337846 IP 192.168.100.130.telnet > 192.168.100.194.53163: Flags [.], ack 203, win 227, options [nop,nop,TS val 4134142 ecr 4134185], length 0
E..4.]@.@.....d...d.....A5...e.J...........
.?...?.)
17:39:15.337963 IP 192.168.100.130.telnet > 192.168.100.194.53163: Flags [.], ack 203, win 227, options [nop,nop,TS val 4134142 ecr 4134185], length 0
E..4.]@.?.....d...d.....A5...e.J...........
.?...?.)
17:39:15.342693 IP 192.168.100.130.telnet > 192.168.100.194.53163: Flags [P.], seq 210:212, ack 203, win 227, options [nop,nop,TS val 4134147 ecr 4134185], length 2
E..6.^@.@.....d...d.....A5...e.J...........
.?...?.)

17:39:15.342794 IP 192.168.100.130.telnet > 192.168.100.194.53163: Flags [P.], seq 210:212, ack 203, win 227, options [nop,nop,TS val 4134147 ecr 4134185], length 2
E..6.^@.?.....d...d.....A5...e.J...........
.?...?.)

17:39:15.342802 IP 192.168.100.194.53163 > 192.168.100.130.telnet: Flags [.], ack 212, win 229, options [nop,nop,TS val 4134190 ecr 4134147], length 0
E..4Xk@.@.....d...d......e.JA5.............
.?...?..
17:39:15.342968 IP 192.168.100.194.53163 > 192.168.100.130.telnet: Flags [.], ack 212, win 229, options [nop,nop,TS val 4134190 ecr 4134147], length 0
E..4Xk@.?.....d...d......e.JA5.............
.?...?..
17:39:15.536212 IP 192.168.100.130.telnet > 192.168.100.194.53163: Flags [P.], seq 212:266, ack 203, win 227, options [nop,nop,TS val 4134337 ecr 4134190], length 54
E..j._@.@.....d...d.....A5...e.J.....
.....
.?...?..Last login: Wed Jun 18 17:37:54 from 192.168.100.194

17:39:15.536353 IP 192.168.100.130.telnet > 192.168.100.194.53163: Flags [P.], seq 212:266, ack 203, win 227, options [nop,nop,TS val 4134337 ecr 4134190], length 54
E..j._@.?.....d...d.....A5...e.J.....
.....
.?...?..Last login: Wed Jun 18 17:37:54 from 192.168.100.194

17:39:15.536379 IP 192.168.100.194.53163 > 192.168.100.130.telnet: Flags [.], ack 266, win 229, options [nop,nop,TS val 4134384 ecr 4134337], length 0
E..4Xl@.@.....d...d......e.JA5.......O.....
.?...?..
17:39:15.536568 IP 192.168.100.194.53163 > 192.168.100.130.telnet: Flags [.], ack 266, win 229, options [nop,nop,TS val 4134384 ecr 4134337], length 0
E..4Xl@.?.....d...d......e.JA5.......O.....
.?...?..
17:39:15.657370 IP 192.168.100.130.telnet > 192.168.100.194.53163: Flags [P.], seq 266:325, ack 203, win 227, options [nop,nop,TS val 4134462 ecr 4134384], length 59
E..o.`@.@.....d...d.....A5...e.J...........
.?.>.?...]0;Clinton@pvssvr10-hn:~..[?1034h[Clinton@pvssvr10-hn ~]$ 
17:39:15.657475 IP 192.168.100.130.telnet > 192.168.100.194.53163: Flags [P.], seq 266:325, ack 203, win 227, options [nop,nop,TS val 4134462 ecr 4134384], length 59
E..o.`@.?.....d...d.....A5...e.J...........
.?.>.?...]0;Clinton@pvssvr10-hn:~..[?1034h[Clinton@pvssvr10-hn ~]$ 
17:39:15.657495 IP 192.168.100.194.53163 > 192.168.100.130.telnet: Flags [.], ack 325, win 229, options [nop,nop,TS val 4134505 ecr 4134462], length 0
E..4Xm@.@.....d...d......e.JA5.V...........
.?.i.?.>
17:39:15.657720 IP 192.168.100.194.53163 > 192.168.100.130.telnet: Flags [.], ack 325, win 229, options [nop,nop,TS val 4134505 ecr 4134462], length 0
E..4Xm@.?.....d...d......e.JA5.V...........
.?.i.?.>
17:39:16.182514 IP 192.168.100.194.53163 > 192.168.100.130.telnet: Flags [P.], seq 203:204, ack 325, win 229, options [nop,nop,TS val 4135030 ecr 4134462], length 1
E..5Xn@.@.....d...d......e.JA5.V....J......
.?.v.?.>e
17:39:16.182871 IP 192.168.100.194.53163 > 192.168.100.130.telnet: Flags [P.], seq 203:204, ack 325, win 229, options [nop,nop,TS val 4135030 ecr 4134462], length 1
E..5Xn@.?.....d...d......e.JA5.V....=......
.?.v.?.>e
17:39:16.189396 IP 192.168.100.130.telnet > 192.168.100.194.53163: Flags [P.], seq 325:326, ack 204, win 227, options [nop,nop,TS val 4134994 ecr 4135030], length 1
E..5.a@.@.....d...d.....A5.V.e.K....:......
.?.R.?.ve
17:39:16.189738 IP 192.168.100.130.telnet > 192.168.100.194.53163: Flags [P.], seq 325:326, ack 204, win 227, options [nop,nop,TS val 4134994 ecr 4135030], length 1
E..5.a@.?.....d...d.....A5.V.e.K....:......
.?.R.?.ve
17:39:16.189761 IP 192.168.100.194.53163 > 192.168.100.130.telnet: Flags [.], ack 326, win 229, options [nop,nop,TS val 4135037 ecr 4134994], length 0
E..4Xo@.@.....d...d......e.KA5.W...........
.?.}.?.R
17:39:16.190126 IP 192.168.100.194.53163 > 192.168.100.130.telnet: Flags [.], ack 326, win 229, options [nop,nop,TS val 4135037 ecr 4134994], length 0
E..4Xo@.?.....d...d......e.KA5.W...........
.?.}.?.R
17:39:16.414654 IP 192.168.100.194.53163 > 192.168.100.130.telnet: Flags [P.], seq 204:205, ack 326, win 229, options [nop,nop,TS val 4135262 ecr 4134994], length 1
E..5Xp@.@.....d...d......e.KA5.W....J......
.?.^.?.Rx
17:39:16.414989 IP 192.168.100.194.53163 > 192.168.100.130.telnet: Flags [P.], seq 204:205, ack 326, win 229, options [nop,nop,TS val 4135262 ecr 4134994], length 1
E..5Xp@.?.....d...d......e.KA5.W....'
.....
.?.^.?.Rx
17:39:16.420834 IP 192.168.100.130.telnet > 192.168.100.194.53163: Flags [P.], seq 326:327, ack 205, win 227, options [nop,nop,TS val 4135225 ecr 4135262], length 1
E..5.b@.@.....d...d.....A5.W.e.L....&$.....
.?.9.?.^x
17:39:16.420979 IP 192.168.100.130.telnet > 192.168.100.194.53163: Flags [P.], seq 326:327, ack 205, win 227, options [nop,nop,TS val 4135225 ecr 4135262], length 1
E..5.b@.?.....d...d.....A5.W.e.L....&$.....
.?.9.?.^x
17:39:16.420998 IP 192.168.100.194.53163 > 192.168.100.130.telnet: Flags [.], ack 327, win 229, options [nop,nop,TS val 4135268 ecr 4135225], length 0
E..4Xq@.@.....d...d......e.LA5.X.....$.....
.?.d.?.9
17:39:16.421200 IP 192.168.100.194.53163 > 192.168.100.130.telnet: Flags [.], ack 327, win 229, options [nop,nop,TS val 4135268 ecr 4135225], length 0
E..4Xq@.?.....d...d......e.LA5.X.....$.....
.?.d.?.9
17:39:16.558299 IP 192.168.100.194.53163 > 192.168.100.130.telnet: Flags [P.], seq 205:206, ack 327, win 229, options [nop,nop,TS val 4135406 ecr 4135225], length 1
E..5Xr@.@.....d...d......e.LA5.X....J......
.?...?.9i
17:39:16.558626 IP 192.168.100.194.53163 > 192.168.100.130.telnet: Flags [P.], seq 205:206, ack 327, win 229, options [nop,nop,TS val 4135406 ecr 4135225], length 1
E..5Xr@.?.....d...d......e.LA5.X....4......
.?...?.9i
17:39:16.564878 IP 192.168.100.130.telnet > 192.168.100.194.53163: Flags [P.], seq 327:328, ack 206, win 227, options [nop,nop,TS val 4135369 ecr 4135406], length 1
E..5.c@.@.....d...d.....A5.X.e.M....4......
.?...?..i
17:39:16.565021 IP 192.168.100.130.telnet > 192.168.100.194.53163: Flags [P.], seq 327:328, ack 206, win 227, options [nop,nop,TS val 4135369 ecr 4135406], length 1
E..5.c@.?.....d...d.....A5.X.e.M....4......
.?...?..i
17:39:16.565036 IP 192.168.100.194.53163 > 192.168.100.130.telnet: Flags [.], ack 328, win 229, options [nop,nop,TS val 4135412 ecr 4135369], length 0
E..4Xs@.@.....d...d......e.MA5.Y...........
.?...?..
17:39:16.565237 IP 192.168.100.194.53163 > 192.168.100.130.telnet: Flags [.], ack 328, win 229, options [nop,nop,TS val 4135412 ecr 4135369], length 0
E..4Xs@.?.....d...d......e.MA5.Y...........
.?...?..
17:39:16.702492 IP 192.168.100.194.53163 > 192.168.100.130.telnet: Flags [P.], seq 206:207, ack 328, win 229, options [nop,nop,TS val 4135550 ecr 4135369], length 1
E..5Xt@.@.....d...d......e.MA5.Y....J......
.?.~.?..t
17:39:16.702820 IP 192.168.100.194.53163 > 192.168.100.130.telnet: Flags [P.], seq 206:207, ack 328, win 229, options [nop,nop,TS val 4135550 ecr 4135369], length 1
E..5Xt@.?.....d...d......e.MA5.Y....(o.....
.?.~.?..t
17:39:16.710623 IP 192.168.100.130.telnet > 192.168.100.194.53163: Flags [P.], seq 328:329, ack 207, win 227, options [nop,nop,TS val 4135515 ecr 4135550], length 1
E..5.d@.@.....d...d.....A5.Y.e.N....'......
.?.[.?.~t
17:39:16.710818 IP 192.168.100.130.telnet > 192.168.100.194.53163: Flags [P.], seq 328:329, ack 207, win 227, options [nop,nop,TS val 4135515 ecr 4135550], length 1
E..5.d@.?.....d...d.....A5.Y.e.N....'......
.?.[.?.~t
17:39:16.710837 IP 192.168.100.194.53163 > 192.168.100.130.telnet: Flags [.], ack 329, win 229, options [nop,nop,TS val 4135558 ecr 4135515], length 0
E..4Xu@.@.....d...d......e.NA5.Z...........
.?...?.[
17:39:16.711349 IP 192.168.100.194.53163 > 192.168.100.130.telnet: Flags [.], ack 329, win 229, options [nop,nop,TS val 4135558 ecr 4135515], length 0
E..4Xu@.?.....d...d......e.NA5.Z...........
.?...?.[
17:39:16.766368 IP 192.168.100.194.53163 > 192.168.100.130.telnet: Flags [P.], seq 207:209, ack 329, win 229, options [nop,nop,TS val 4135614 ecr 4135515], length 2
E..6Xv@.@.....d...d......e.NA5.Z....J......
.?...?.[.
17:39:16.766582 IP 192.168.100.194.53163 > 192.168.100.130.telnet: Flags [P.], seq 207:209, ack 329, win 229, options [nop,nop,TS val 4135614 ecr 4135515], length 2
E..6Xv@.?.....d...d......e.NA5.Z...........
.?...?.[.
17:39:16.771105 IP 192.168.100.130.telnet > 192.168.100.194.53163: Flags [P.], seq 329:338, ack 209, win 227, options [nop,nop,TS val 4135573 ecr 4135614], length 9
E..=.e@.@.....d...d.....A5.Z.e.P....4......
.?...?..
logout

17:39:16.771206 IP 192.168.100.130.telnet > 192.168.100.194.53163: Flags [P.], seq 329:338, ack 209, win 227, options [nop,nop,TS val 4135573 ecr 4135614], length 9
E..=.e@.?.....d...d.....A5.Z.e.P....4......
.?...?..
logout

17:39:16.771217 IP 192.168.100.194.53163 > 192.168.100.130.telnet: Flags [.], ack 338, win 229, options [nop,nop,TS val 4135619 ecr 4135573], length 0
E..4Xw@.@.....d...d......e.PA5.c.....Z.....
.?...?..
17:39:16.771384 IP 192.168.100.194.53163 > 192.168.100.130.telnet: Flags [.], ack 338, win 229, options [nop,nop,TS val 4135619 ecr 4135573], length 0
E..4Xw@.?.....d...d......e.PA5.c.....Z.....
.?...?..
17:39:16.772393 IP 192.168.100.130.telnet > 192.168.100.194.53163: Flags [F.], seq 338, ack 209, win 227, options [nop,nop,TS val 4135576 ecr 4135614], length 0
E..4.f@.@.....d...d.....A5.c.e.P.....].....
.?...?..
17:39:16.772458 IP 192.168.100.130.telnet > 192.168.100.194.53163: Flags [F.], seq 338, ack 209, win 227, options [nop,nop,TS val 4135576 ecr 4135614], length 0
E..4.f@.?.....d...d.....A5.c.e.P.....].....
.?...?..
17:39:16.772513 IP 192.168.100.194.53163 > 192.168.100.130.telnet: Flags [F.], seq 209, ack 339, win 229, options [nop,nop,TS val 4135620 ecr 4135576], length 0
E..4Xx@.@.....d...d......e.PA5.d.....T.....
.?...?..
17:39:16.772749 IP 192.168.100.194.53163 > 192.168.100.130.telnet: Flags [F.], seq 209, ack 339, win 229, options [nop,nop,TS val 4135620 ecr 4135576], length 0
E..4Xx@.?.....d...d......e.PA5.d.....T.....
.?...?..
17:39:16.772821 IP 192.168.100.130.telnet > 192.168.100.194.53163: Flags [.], ack 210, win 227, options [nop,nop,TS val 4135577 ecr 4135620], length 0
E..4.g@.@.....d...d.....A5.d.e.Q.....U.....
.?...?..
17:39:16.772939 IP 192.168.100.130.telnet > 192.168.100.194.53163: Flags [.], ack 210, win 227, options [nop,nop,TS val 4135577 ecr 4135620], length 0
E..4.g@.?.....d...d.....A5.d.e.Q.....U.....
.?...?..

pvssvr10-bln2.txt                                                                                   0000644 0001752 0000144 00000024435 12356535032 012526  0                                                                                                    ustar   mo                              users                                                                                                                                                                                                                  17:44:17.277112 IP 192.168.100.194.47694 > 192.168.100.130.ftp: Flags [S], seq 953920844, win 14600, options [mss 1460,sackOK,TS val 4436124 ecr 0,nop,wscale 6], length 0
E..<..@.@..V..d...d..N..8..L......9.r..........
.C..........
17:44:17.277354 IP 192.168.100.194.47694 > 192.168.100.130.ftp: Flags [S], seq 953920844, win 14600, options [mss 1460,sackOK,TS val 4436124 ecr 0,nop,wscale 6], length 0
E..<..@.?..V..d...d..N..8..L......9.r..........
.C..........
17:44:17.277476 IP 192.168.100.130.ftp > 192.168.100.194.47694: Flags [S.], seq 2482457856, ack 953920845, win 14480, options [mss 1460,sackOK,TS val 4436082 ecr 4436124,nop,wscale 6], length 0
E..<..@.@..&..d...d....N..M.8..M..8............
.C.r.C......
17:44:17.277628 IP 192.168.100.130.ftp > 192.168.100.194.47694: Flags [S.], seq 2482457856, ack 953920845, win 14480, options [mss 1460,sackOK,TS val 4436082 ecr 4436124,nop,wscale 6], length 0
E..<..@.?..&..d...d....N..M.8..M..8............
.C.r.C......
17:44:17.277644 IP 192.168.100.194.47694 > 192.168.100.130.ftp: Flags [.], ack 1, win 229, options [nop,nop,TS val 4436125 ecr 4436082], length 0
E..4..@.@..]..d...d..N..8..M..M.....H'.....
.C...C.r
17:44:17.277868 IP 192.168.100.194.47694 > 192.168.100.130.ftp: Flags [.], ack 1, win 229, options [nop,nop,TS val 4436125 ecr 4436082], length 0
E..4..@.?..]..d...d..N..8..M..M.....H'.....
.C...C.r
17:44:17.279273 IP 192.168.100.130.ftp > 192.168.100.194.47694: Flags [P.], seq 1:21, ack 1, win 227, options [nop,nop,TS val 4436082 ecr 4436125], length 20
E..H.s@.@.....d...d....N..M.8..M...........
.C.r.C..220 (vsFTPd 2.2.2)

17:44:17.279276 IP 192.168.100.130.ftp > 192.168.100.194.47694: Flags [P.], seq 1:21, ack 1, win 227, options [nop,nop,TS val 4436082 ecr 4436125], length 20
E..H.s@.?.....d...d....N..M.8..M...........
.C.r.C..220 (vsFTPd 2.2.2)

17:44:17.279374 IP 192.168.100.194.47694 > 192.168.100.130.ftp: Flags [.], ack 21, win 229, options [nop,nop,TS val 4436127 ecr 4436082], length 0
E..4..@.@..L..d...d..N..8..M..M.....H......
.C...C.r
17:44:17.279495 IP 192.168.100.194.47694 > 192.168.100.130.ftp: Flags [P.], seq 1:14, ack 21, win 229, options [nop,nop,TS val 4436127 ecr 4436082], length 13
E..A..@.@..>..d...d..N..8..M..M.....J......
.C...C.rAUTH GSSAPI

17:44:17.279566 IP 192.168.100.194.47694 > 192.168.100.130.ftp: Flags [.], ack 21, win 229, options [nop,nop,TS val 4436127 ecr 4436082], length 0
E..4..@.?..L..d...d..N..8..M..M.....H......
.C...C.r
17:44:17.279694 IP 192.168.100.194.47694 > 192.168.100.130.ftp: Flags [P.], seq 1:14, ack 21, win 229, options [nop,nop,TS val 4436127 ecr 4436082], length 13
E..A..@.?..>..d...d..N..8..M..M......f.....
.C...C.rAUTH GSSAPI

17:44:17.279795 IP 192.168.100.130.ftp > 192.168.100.194.47694: Flags [.], ack 14, win 227, options [nop,nop,TS val 4436084 ecr 4436127], length 0
E..4.t@.@.....d...d....N..M.8..Z....H......
.C.t.C..
17:44:17.279952 IP 192.168.100.130.ftp > 192.168.100.194.47694: Flags [P.], seq 21:59, ack 14, win 227, options [nop,nop,TS val 4436084 ecr 4436127], length 38
E..Z.u@.@.....d...d....N..M.8..Z...........
.C.t.C..530 Please login with USER and PASS.

17:44:17.279955 IP 192.168.100.130.ftp > 192.168.100.194.47694: Flags [.], ack 14, win 227, options [nop,nop,TS val 4436084 ecr 4436127], length 0
E..4.t@.?.....d...d....N..M.8..Z....H......
.C.t.C..
17:44:17.279958 IP 192.168.100.130.ftp > 192.168.100.194.47694: Flags [P.], seq 21:59, ack 14, win 227, options [nop,nop,TS val 4436084 ecr 4436127], length 38
E..Z.u@.?.....d...d....N..M.8..Z...........
.C.t.C..530 Please login with USER and PASS.

17:44:17.320385 IP 192.168.100.194.47694 > 192.168.100.130.ftp: Flags [.], ack 59, win 229, options [nop,nop,TS val 4436168 ecr 4436084], length 0
E..4..@.@..J..d...d..N..8..Z..M;....G......
.C...C.t
17:44:17.320676 IP 192.168.100.194.47694 > 192.168.100.130.ftp: Flags [.], ack 59, win 229, options [nop,nop,TS val 4436168 ecr 4436084], length 0
E..4..@.?..J..d...d..N..8..Z..M;....G......
.C...C.t
17:44:20.645852 IP 192.168.100.194.47694 > 192.168.100.130.ftp: Flags [P.], seq 14:28, ack 59, win 229, options [nop,nop,TS val 4439493 ecr 4436084], length 14
E..B..@.@..;..d...d..N..8..Z..M;....J......
.C...C.tUSER Clinton

17:44:20.646163 IP 192.168.100.194.47694 > 192.168.100.130.ftp: Flags [P.], seq 14:28, ack 59, win 229, options [nop,nop,TS val 4439493 ecr 4436084], length 14
E..B..@.?..;..d...d..N..8..Z..M;....(a.....
.C...C.tUSER Clinton

17:44:20.646370 IP 192.168.100.130.ftp > 192.168.100.194.47694: Flags [P.], seq 59:93, ack 28, win 227, options [nop,nop,TS val 4439451 ecr 4439493], length 34
E..V.v@.@.....d...d....N..M;8..h.....7.....
.C...C..331 Please specify the password.

17:44:20.646470 IP 192.168.100.130.ftp > 192.168.100.194.47694: Flags [P.], seq 59:93, ack 28, win 227, options [nop,nop,TS val 4439451 ecr 4439493], length 34
E..V.v@.?.....d...d....N..M;8..h.....7.....
.C...C..331 Please specify the password.

17:44:20.646512 IP 192.168.100.194.47694 > 192.168.100.130.ftp: Flags [.], ack 93, win 229, options [nop,nop,TS val 4439494 ecr 4439451], length 0
E..4..@.@..H..d...d..N..8..h..M]....-^.....
.C...C..
17:44:20.646702 IP 192.168.100.194.47694 > 192.168.100.130.ftp: Flags [.], ack 93, win 229, options [nop,nop,TS val 4439494 ecr 4439451], length 0
E..4..@.?..H..d...d..N..8..h..M]....-^.....
.C...C..
17:44:25.781389 IP 192.168.100.194.47694 > 192.168.100.130.ftp: Flags [P.], seq 28:49, ack 93, win 229, options [nop,nop,TS val 4444629 ecr 4439451], length 21
E..I..@.@..2..d...d..N..8..h..M]....J......
.C...C..PASS Obama$$barrack

17:44:25.781646 IP 192.168.100.194.47694 > 192.168.100.130.ftp: Flags [P.], seq 28:49, ack 93, win 229, options [nop,nop,TS val 4444629 ecr 4439451], length 21
E..I..@.?..2..d...d..N..8..h..M].....".....
.C...C..PASS Obama$$barrack

17:44:25.802551 IP 192.168.100.130.ftp > 192.168.100.194.47694: Flags [P.], seq 93:116, ack 49, win 227, options [nop,nop,TS val 4444606 ecr 4444629], length 23
E..K.w@.@.....d...d....N..M]8..}....#......
.C...C..230 Login successful.

17:44:25.802668 IP 192.168.100.130.ftp > 192.168.100.194.47694: Flags [P.], seq 93:116, ack 49, win 227, options [nop,nop,TS val 4444606 ecr 4444629], length 23
E..K.w@.?.....d...d....N..M]8..}....#......
.C...C..230 Login successful.

17:44:25.802715 IP 192.168.100.194.47694 > 192.168.100.130.ftp: Flags [.], ack 116, win 229, options [nop,nop,TS val 4444650 ecr 4444606], length 0
E..4..@.@..F..d...d..N..8..}..Mt...........
.C...C..
17:44:25.802809 IP 192.168.100.194.47694 > 192.168.100.130.ftp: Flags [P.], seq 49:55, ack 116, win 229, options [nop,nop,TS val 4444650 ecr 4444606], length 6
E..:..@.@..?..d...d..N..8..}..Mt....J......
.C...C..SYST

17:44:25.802868 IP 192.168.100.194.47694 > 192.168.100.130.ftp: Flags [.], ack 116, win 229, options [nop,nop,TS val 4444650 ecr 4444606], length 0
E..4..@.?..F..d...d..N..8..}..Mt...........
.C...C..
17:44:25.802929 IP 192.168.100.194.47694 > 192.168.100.130.ftp: Flags [P.], seq 49:55, ack 116, win 229, options [nop,nop,TS val 4444650 ecr 4444606], length 6
E..:..@.?..?..d...d..N..8..}..Mt....Q%.....
.C...C..SYST

17:44:25.803123 IP 192.168.100.130.ftp > 192.168.100.194.47694: Flags [P.], seq 116:135, ack 55, win 227, options [nop,nop,TS val 4444607 ecr 4444650], length 19
E..G.x@.@.....d...d....N..Mt8........z.....
.C...C..215 UNIX Type: L8

17:44:25.803125 IP 192.168.100.130.ftp > 192.168.100.194.47694: Flags [P.], seq 116:135, ack 55, win 227, options [nop,nop,TS val 4444607 ecr 4444650], length 19
E..G.x@.?.....d...d....N..Mt8........z.....
.C...C..215 UNIX Type: L8

17:44:25.843868 IP 192.168.100.194.47694 > 192.168.100.130.ftp: Flags [.], ack 135, win 229, options [nop,nop,TS val 4444691 ecr 4444607], length 0
E..4..@.@..D..d...d..N..8.....M............
.C...C..
17:44:25.844162 IP 192.168.100.194.47694 > 192.168.100.130.ftp: Flags [.], ack 135, win 229, options [nop,nop,TS val 4444691 ecr 4444607], length 0
E..4..@.?..D..d...d..N..8.....M............
.C...C..
17:44:27.910084 IP 192.168.100.194.47694 > 192.168.100.130.ftp: Flags [P.], seq 55:61, ack 135, win 229, options [nop,nop,TS val 4446757 ecr 4444607], length 6
E..:..@.@..=..d...d..N..8.....M.....J......
.C.%.C..QUIT

17:44:27.910434 IP 192.168.100.194.47694 > 192.168.100.130.ftp: Flags [P.], seq 55:61, ack 135, win 229, options [nop,nop,TS val 4446757 ecr 4444607], length 6
E..:..@.?..=..d...d..N..8.....M.....T......
.C.%.C..QUIT

17:44:27.910528 IP 192.168.100.130.ftp > 192.168.100.194.47694: Flags [P.], seq 135:149, ack 61, win 227, options [nop,nop,TS val 4446715 ecr 4446757], length 14
E..B.y@.@.....d...d....N..M.8........h.....
.C...C.%221 Goodbye.

17:44:27.910594 IP 192.168.100.130.ftp > 192.168.100.194.47694: Flags [F.], seq 149, ack 61, win 227, options [nop,nop,TS val 4446715 ecr 4446757], length 0
E..4.z@.@.....d...d....N..M.8........F.....
.C...C.%
17:44:27.910653 IP 192.168.100.130.ftp > 192.168.100.194.47694: Flags [P.], seq 135:149, ack 61, win 227, options [nop,nop,TS val 4446715 ecr 4446757], length 14
E..B.y@.?.....d...d....N..M.8........h.....
.C...C.%221 Goodbye.

17:44:27.910717 IP 192.168.100.130.ftp > 192.168.100.194.47694: Flags [F.], seq 149, ack 61, win 227, options [nop,nop,TS val 4446715 ecr 4446757], length 0
E..4.z@.?.....d...d....N..M.8........F.....
.C...C.%
17:44:27.910791 IP 192.168.100.194.47694 > 192.168.100.130.ftp: Flags [.], ack 149, win 229, options [nop,nop,TS val 4446758 ecr 4446715], length 0
E..4..@.@..B..d...d..N..8.....M......D.....
.C.&.C..
17:44:27.910971 IP 192.168.100.194.47694 > 192.168.100.130.ftp: Flags [.], ack 149, win 229, options [nop,nop,TS val 4446758 ecr 4446715], length 0
E..4..@.?..B..d...d..N..8.....M......D.....
.C.&.C..
17:44:27.911137 IP 192.168.100.194.47694 > 192.168.100.130.ftp: Flags [F.], seq 61, ack 150, win 229, options [nop,nop,TS val 4446758 ecr 4446715], length 0
E..4..@.@..A..d...d..N..8.....M......B.....
.C.&.C..
17:44:27.911538 IP 192.168.100.194.47694 > 192.168.100.130.ftp: Flags [F.], seq 61, ack 150, win 229, options [nop,nop,TS val 4446758 ecr 4446715], length 0
E..4..@.?..A..d...d..N..8.....M......B.....
.C.&.C..
17:44:27.911540 IP 192.168.100.130.ftp > 192.168.100.194.47694: Flags [.], ack 62, win 227, options [nop,nop,TS val 4446716 ecr 4446758], length 0
E..4.{@.@.....d...d....N..M.8........C.....
.C...C.&
17:44:27.911541 IP 192.168.100.130.ftp > 192.168.100.194.47694: Flags [.], ack 62, win 227, options [nop,nop,TS val 4446716 ecr 4446758], length 0
E..4.{@.?.....d...d....N..M.8........C.....
.C...C.&

                                                                                                                                                                                                                                                                                                                                                                                                                                                                                                                                                                                                                                                                                                                                                                                                                                                                                                                                                                                                                                                                                                                                                                                                                                                                                                                                                                                                                                                                                                                                                                                                                                                                                                                                                                                                                                                                                                                                                                                                                                                                                                                                                                                                                                                                                                                                                                                                                                                                                                                                                                                                                                                                                                                                                                                                                                                                                                                                                                                                                                                                                                                                                                                                                                                                                                                                                                                                                                                                                                                                                                                                                                                                                                                                                                                                                                                                                                                                                                                                                                                                                                                                                                                                                                                                                                                                                                                                                                                                                                                                                                                                                                                                                                                                                                                                                                                                                                                                                                                                                                                                                                                                                                                                                                                                                                                                                                                                                                                                                                                                                                                                                                                                                                                                                                                                                                                                                                                                                                                                                                                                                                                                                                                                                                                                                                                                                                                                                                                                                                                                                                                                                                                                                                                                                                                                                                                                                                                                                                                                                                                                                                                                                                                                                                                                                                                                                                                                                                                                                                                                                                                                                                                                                                                                                                                                                                                                                                                                                                                                                                                                                                                                                                                                                                                                                                                                                                                                                                                                                                                                                                                                                                                                                                                                                                                                                                                                                                                                                                                                                                                                                                                                                                                                                                                                                                                                                                                                                                                                                                                                                                                                                                                                                                                                                                                                                                   